title,text,url,race_label
Why car prices are still so high — and why they are unlikely to fall anytime soon,"It has been nearly three years since auto plants around the world started to shut down because of the pandemic.Yet between the pandemic, an acute shortage of semiconductors and other supply chain snarls, vehicle production has never really returned to normal.And prices? Hoo boy.Both new and used prices have stopped skyrocketing. In fact, both dipped slightly in February.But the average new-vehicle transaction price is still $48,763, according to Kelley Blue Book. Before the pandemic, the average new vehicle sold for $37,876.At an auto show this year, Noah and India Grabisch of Laurel, Md., were looking at new SUVs, which they liked. But an $86,000 price tag for a Chevrolet Suburban?Well ...""It looks nice,"" India Grabisch said. ""But ... no.""The used-car market doesn't provide much relief either. Retail used-vehicle prices now average $26,510.And after falling last year, closely watched wholesale prices, a key indicator of where markets are headed, are actually rising again.Why are prices remaining stubbornly high? Here are a few reasons.Supply chain woes are still reverberatingThe semiconductor shortage has gotten much better since 2021, but it hasn't gone away entirely, and other supply chain snarls continue to periodically disrupt output.Because of these supply chain problems, the global automotive industry has produced millions fewer vehicles than it would have otherwise.The supply of new vehicles is starting to improve, but those millions of ""missing"" vehicles are still gone. Lower supply, higher prices: It's basic economics.Which cars are being made? Not the cheap onesWhen automakers can't make as many vehicles as they would like, they prioritize their most profitable cars. Cheap ones get the boot.Consider what happened at Nissan, which continued to struggle with supply chain challenges throughout 2022. In response, it cut production of one of its cheapest cars, the Nissan Versa, by 78%. Nissan also reduced sales of two other cheap models, the Sentra and the Kicks.Bigger, slightly more expensive vehicles, like the Altima and the Pathfinder? Nissan boosted production of those.It wasn't because of a lack of buyers on the cheap end, says Judy Wheeler, Nissan U.S.'s vice president for sales and regional operations.""In the last month, we have seen search increase for the Nissan Versa, Sentra and Kicks, indicating a growing interest in this segment among consumers,"" she told NPR via email.She said Nissan intends to build more of those entry-level vehicles when the supply chain permits.It's not just Nissan. Across the board, automakers have been focusing on bigger, more luxurious, more expensive vehicles. And the ones they make also tend to be packed with extra features that bump up prices even more.Fewer cars — and higher prices — are very profitableThe shift in the market has been remarkable, and automakers are in no hurry to reverse course.Consider just how big the change has been. Cox Automotive crunched the numbers and found that from December 2017 to December 2022, sales of new cars under $25,000 — affordable, by new-car standards — dropped 78% and went from almost 13% of total new-vehicle sales to just under 4%.Sales of new cars over $60,000, meanwhile, skyrocketed. Those vehicles, costing more than the annual income of the average American, went from 8% of the auto market to 25% of sales.Because those $60,000 vehicles are significantly more profitable than the $25,000 ones, this shift is very, very lucrative for car companies. And they're especially focused on fat margins, instead of big volumes, because they're investing heavily in new electric vehicles (EVs).""The pricing environment that we're in right now has been very good, very robust,"" General Motors Chief Financial Officer Paul Jacobson told investors on an earnings call last year. ""And ... running the business for cash flow is critical to help fund our journey in the EV transformation.""Yesterday's new cars are today's used cars ...Three years ago, when production lines started to slow, it affected both the new- and used-car markets immediately. Fewer new cars sent new prices up. That, in turn, pushed many shoppers into the used-car market. And more shoppers in the used market pushed prices up there, too.But the new-car woes also had a delayed effect on the used-car market — because new cars, obviously, become used cars after some time.So all those top-of-the line cars that were made in 2021 are now some very nice two-year-old cars, which means even in the used market, the high end of the market is booming.Meanwhile, because automakers cut production of cheap, no-frill sedans, people looking for cheaper late-model used cars are now out of luck.""We are firmly in the teeth of an extremely tight used-vehicle market, and that is directly a function of what has happened over the past three years,"" says Jonathan Smoke, chief economist at Cox Automotive.Lonnie Smith, president of the nonprofit On the Road Lending, works to help working families get affordable loans for decent used cars, preferably those still under warranty.""Typically we're looking for vehicles that are two to four years old, less than 60,000 miles — a modest type of vehicle,"" he says.Those have gotten so hard to find lately that On the Road got licensed to be an auto dealer so it could buy vehicles at auction — the few cars that fit the bill on dealer lots were getting snapped up immediately.And the average loan for those cars, which was $13,000 ten years ago, has now risen to $24,000.Because, well, that's just the price of a modest used car in America these days.But there is some hope: EV prices could come downAs the chip shortage eases, automakers say they want to make more vehicles for people who can't afford top-of-the-line full-size SUVs. But don't expect a tsunami of $15,000 cars.""We're not really expecting to see, you know, this resurgence of inexpensive gasoline-powered vehicles,"" says Ed Kim, chief analyst at AutoPacific. ""Really where the industry is going is putting in a lot of effort to get more affordable plug-in vehicles out in the marketplace.""In fact, led by Tesla's aggressive price cuts, electric vehicle prices are dropping. According to the latest Kelley Blue Book data, they're down 7.5% year over year, and that's before federal tax credits (including for used vehicles).But there are daunting challenges — especially around charging infrastructure — before many car buyers will purchase an EV. And prices have a long way to fall before they're truly affordable. Investors were recently disappointed when Tesla, which has long promised a cheaper vehicle, did not unveil one.So cheaper vehicles are on the way. But many of them will be powered by batteries, and they'll take a long time to get here. [Copyright 2023 NPR]",https://www.wgbh.org/news/national/2023-03-18/why-car-prices-are-still-so-high-and-why-they-are-unlikely-to-fall-anytime-soon,N/A - not specified
Boston City Council approves Wu's rent control and city planning proposals,"The Boston City Council Wednesday approved proposals to implement rent control and restructure the city’s planning and development agency, advancing two major pieces of Mayor Michelle Wu’s legislative agenda forward to state lawmakers.Both measures passed 11-2, with Councilors Frank Baker and Erin Murphy voting against them.In a rare, post-vote media appearance, Wu said the council ""delivered a strong message"" with the rent control approval.""The city of Boston needs the tools to address our housing crisis,"" Wu said. ""We hear from residents across every single neighborhood just how dire it is and we see families who are getting pushed out of the communities that they grew up in and helped to build. This is affecting everything from how our businesses and economy can recover to our school enrollment and the stability of every part of our neighborhoods.""The topic of rent controlwas controversial even beforethe city began discussing Wu’s proposal in earnest.The mayor is seeking to usurp a 1990s statewide ban on the policy and restore a local form of rent control in Boston. Even though a recent poll suggests the policy is popular among likely voters statewide, the Massachusetts Legislature hasshown little appetite for taking up the issue.""The goal, as always, is to be in a conversation with our city government, with our residents, with our state government,"" Wu said when asked about the measure's likelihood of success on Beacon Hill. ""We all represent the same constituents, we all hear from the same families who are struggling to hang on in the city. ... I think we all share an urgency in knowing that this can't stand for Boston.""Wu has largely been alone as a city executive championing the issue. Mayors from several of Massachusetts' largest cities, including Cambridge, Fall River and Lynn, have indicated they have no plans to pursue their own rent control proposals. So far, only the city of Somerville, which previously had a rent control policy, has begun exploring a local option.Somerville City Council President Ben Ewen-Campen said the city's proposal is in its early stages, but they hope to present a finalized version for approval on Beacon Hill this fall. He noted that Somerville has previously sought — and failed — to bring back rent control. But he is more hopeful this time around.""I think we're at a really important point where we have a governor who has indicated that she is supportive of municipalities taking this step,"" Ewen-Campen said.He said he considers rent control a reasonable approach to help working class people live in the city.""The extreme position is what we have now,"" he explained, ""where some real estate investor or some LLC can buy up an apartment building and jack up the rent 30%, 40%, 100% and just evict people who have been in Somerville for years and have kids in the schools.""In Boston, Wu’s rent control proposal has upset both those with interests in the real estate sector and progressive housing advocates. TheMassLandlords trade groupand the Greater Boston Real Estate Board have publicly lobbied against Wu’s proposal, arguing that it would stifle housing production and worsen the city’s housing crisis.MassLandlords also argued Wu’s proposal, which exempts owners who live with their tenants and own six units or less, leaves out landlords who don’t live with their tenants, but still reside within the city of Boston.Councilor Michael Flaherty proposed an ultimately unsuccessful amendment to address that concern. Multiple councilors spoke against it, arguing that there’s a distinction between landlords who live with their renters and those who own investment properties.Meanwhile, housing advocates wanted totighten portions of Wu’s planby lowering the annual increase beyond 10% in high inflation years, or the rate of inflation plus 6% in most other years.Wu’s proposal exempts college-operated dormitories and residential buildings for 15 years beginning from the date of their certificate of occupancy. It would also establish eviction protections and bar a landlord from recovering possession of a unit unless a housing court approves.Wu’sagency restructure planwould, if approved by the Legislature and Gov. Maura Healey, formally dissolve the Boston Redevelopment Authority, the official entity created in 1957 to oversee the city’s development activities in the era of urban renewal. The measure would codify a focus on three key planning principles — resilience, affordability and equity — and would also dissolve the partner Economic Development Industrial Corporation, established in 1971 to lead local economic development activities.Wu said Wednesday she expects ""strong"" support for the measure at the State House.The BRA began doing business as the Boston Planning and Development Agency in 2016 when then-Mayor Marty Walsh made a $600,000 bid to rebrand the agency to shed its reputation as inefficient and overly responsive to the desires of developers. Wu’s proposal would maintain the rebranded name.Councilors approved one amendment to Wu’s plan that maintains urban renewal land disposition agreements, area-specific restrictions that spell out what can and cannot be built in a given place.SeparatorGBH News reporter Tori Bedford contributed reporting on Somerville's rent control proposal.",https://www.wgbh.org/news/politics/2023-03-08/boston-city-council-approves-wus-rent-control-and-city-planning-proposals,N/A - not specified
‘We have a crisis’: Leaders look to address root of gun violence in Boston,"So far this year, 16 people have been murdered in Boston, with Dorchester being the most affected neighborhood.But Ruth Zakarin, executive director of the Massachusetts Coalition to Prevent Gun Violence, said that statistic doesn't cover the full trauma people are experiencing.""Ultimately, if we have one death from gun violence, one family bereaved, one community traumatized, then we have a crisis,"" Zakarin said onGreater Boston. ""We shouldn't have any deaths from gun violence. There are ways to prevent this and make this narrative different.""Zakarin and Donald Osgood Sr., interim director of the Neighborhood Trauma Team Network, are two advocates at the forefront of the effort to reduce violence in Boston. They said teens and young adults have been advocating for change and driving engagement forward.Osgood said bridging gaps with mental health, education and policing are all key to helping reduce violence.""If we don't have resources in the community for the young people, the system is kind of stacked against them,"" he said. ""And until we understand that, we will go around in circles.""Watch: ‘If we have one death ... we have a crisis’: Leaders look to address root of gun violence in Boston",https://www.wgbh.org/news/local/2023-06-06/we-have-a-crisis-leaders-look-to-address-root-of-gun-violence-in-boston,N/A - not specified
It should be so much easier to cancel unwanted subscriptions,"Recently I spent the better part of two days in conversation with the fraud alert team at my bank. My debit card expired, and I was slow to update the information about the new card at all the various places where it’s registered. I knew the old card was expired; I had cut it up for extra security. I was merrily attempting to make my purchases online and in person using the new debit card with the new expiration date. But it was denied and kept being denied.Since the old card was designated as the default payment, I was racking up a bunch of bouncebacks — denials — on attempted purchases which triggered the fraud algorithms. Though I ended up in several rounds of time-consuming conversations, I appreciated the assertive vigilance of the fraud team’s multiple-step verification process. And it turns out that being forced to navigate the process proved to be revealing in another way.Reviewing the attempted charges with the fraud team, I discovered most of the denied purchases were subscriptions. My seemingly endless list of subscriptions —to everything from artisan cosmetic products to niche newsletters, to small household products, to a number of others allowing certain websites’ content. The fraud alerts shut down the automatic billings until I could verify the charges giving me a fresh look at my weekly, monthly, bi-monthly and yearly subscriptions.Many of these subscriptions I had forgotten about or were impulse purchases that didn’t make any sense beyond the moment. Seriously, why do I have a subscription for a weekly specialty drink, when I rarely sip anything but water and coffee? Because in order to sample ONE of the specialty sips, I had to sign up for the free trial. I got distracted, missed the end of the free trial and here I am months later paying regularly for that singular sip. I haven’t even been back to the store to sample another!Of course, it’s my fault. Savvy marketers know just how to entice consumers like me into subscribing because they also know we will likely fail to pay attention to the details. And when you do pay attention, they don’t make it easy for you to unsubscribe.Truly, nobody has time or energy for the inevitable consumer tug-of-war best described by Michael Corleone’s iconic line from the Godfather Part 3 movie: “Just when I thought I was out, they pulled me back in.” The Federal Trade Commission, charged with enforcing consumer protection against fraud, deception, and unfair practices, has heard from thousands about the problem. TheCommission’s recent proposalwould require businesses to alert consumers that their subscriptions are about to renew, and to stop companies from making special offers coupled with high pressure tactics to make you keep the subscription. The so-called “click to cancel” proposal would make it as easy to unsubscribe as it is to subscribe.The agency is soliciting public comment on the proposal. Let the FTC know we want out when we want out — and not when businesses say so. In the meantime, you can spot me at the drink counter trying to get my money’s worth.",https://www.wgbh.org/news/commentary/2023-04-03/it-should-be-so-much-easier-to-cancel-unwanted-subscriptions,N/A - not specified
Basic Black: How will Boston’s task force on reparations confront generational trauma caused by enslavement?,"Communities across the nation are beginning the process of acknowledging the scope of the injustices done to Black people throughout their histories. Many local and state governments are developing initiatives for reparations to balance the scales.Here in Boston, Mayor Michelle Wu marked the start of Black History Month byannouncing the members of a new task forceto study reparations, noting the ""brutal practice of enslavement"" along with policies such as redlining, the busing crisis, exclusion from secure and stable housing, and more. The task force — a multigenerational group of historians, activists and students — is planning on meeting soon to discuss their ideas on how to approach the complexity of reparatory justice. As they do the meticulous work of documentation and reflection over the next year, the city will wait to look with a careful eye at their conclusions.Addressing systemic racism and the harms caused by slavery is about more than just financial compensation for descendants of enslaved people. Guests onBasic Blacksaid the efforts should also work to address other challenges facing the African American community such as health care access, housing access, psychological harm and the erasure of Black history, among many other issues.Carrie Mays, a member of Boston's Task Force on Reparations and student at UMass Boston, said reparations should be viewed as a starting point for further conversation and work.""Reparations is not going to stop police from killing Black men in the streets,"" Mays said. ""Reparations is not going to stop Black women from dying at the highest demographical number when it comes to the medical field. Reparations is not going to stop the mass incarceration machine system that we're seeing today.""Even though slavery was abolished more than 150 years ago, Mays said reparations are important because Black communities are still suffering at the expense of white supremacy, and white communities are still benefitting from privilege.""You cannot talk about the systemic issues of today without talking about slavery, without talking about colonialism, without talking about how this is a connected timeline,"" Mays said.George “Chip” Greenidge, a task force member and founder and director of Greatest MINDS, said he's proud of Mayor Wu for taking on this initiative, which he said has been brewing for quite awhile.""I really want to push on intergenerational poverty that we've seen in the city. I think there are certain families born and raised here that have been in the cycle of intergenerational poverty,"" Greenidge said. ""How can we help them break through those cycles?""Overall, there simply won't be enough money to compensate all descendants of slaves, said Traci Griffith, director of the Racial Justice Program at the ACLU of Massachusetts. That's why compensation will have to come in more creative ways that address harms such as redlining, busing and other inequities.""I would really strongly urge the task force to look at the multiple ways in which compensation could happen. It isn't necessarily a dollar amount. It really feels as if there's so many other ways in which it can be addressed, and I think they really need to be creative about that,"" Griffith said.The Boston Task Force on Reparations has 10 members. It is currently looking for a research partner to aid in studying the lasting impacts of slavery in Boston. A request for proposals will soon be issued.Watch the latest episode ofBasic Blacktonight at 7:30 p.m. on GBH 2 or live at the stream below. You can also watch on theGBH News YouTubechannel. Subscribe to get notifications for future premiere episodes.",https://www.wgbh.org/news/local/2023-03-17/basic-black-how-will-bostons-task-force-on-reparations-confront-generational-trauma-caused-by-enslavement,Black
