title,text,url,race_label
"The average Boston University LGBTQ+ student feels unwelcome, says new report","While many schools in Boston like to tout their diversity, equity and inclusion initiatives, an LGBTQIA+ student task force at Boston University tooka closer lookat their own university's efforts. They were shocked by what they found. Out of 46 peer schools, including Harvard, MIT, Boston College, Tufts and Northeastern, BU ranked last in LGBTQ+ support communities and academic resources. To address this, the task force recommended the creation of a new student resource center — and BU did just that. Christa Rose, BU student and co-founder of the task force, joinedAll Things Consideredhost Arun Rath to discuss the student-led effort to make Boston University more inclusive. This transcript has been lightly edited.Arun Rath:So I understand the task force came together in the spring of last year, but take us back a little bit further and tell us more about what prompted the creation of the task force. I laid out those numbers at the beginning, but give us a sense of what that meant.Christa Rose:As you mentioned, our task force formed last spring in response to the lack of institutional inquiry into the experiences, concerns and needs of LGBTQIA+ students. So in 2018, BU actually charged an LGBTQIA+ task force for faculty and staff, and they were explicitly told not to look at the experiences and needs of students. That task force led to the creation of the LGBTQIA+ Center for Faculty and Staff.While a parallel task force was rumored to be created around the same time, four years went by, and none ever was. So using the 2018 final report of the LGBTQIA+ task force for faculty and staff as a model, we decided to form our own task force by students, for students. Unlike the 2018 task force, ours was not officially charged by the university.In terms of timeline, from February to October of 2022, we launched an inquiry into the climate for LGBTQIA+ BU students and then compiled their findings and 16 recommendations to improve the climate into a 126-page report that was delivered to the president and provost in November of 2022.Rath:In putting together that substantial report, how did you deploy to find this out? What were the research methods that you used to make sure you were hearing from everyone on campus?Rose:We knew that the issues that LGBTQ+ students were facing were really multifaceted, so we wanted to make sure that we took a multifaceted approach to collect data on the climate. We really wanted to use a research-driven academic approach to advocacy, given that BU is a research-driven academic institution. We felt that they would be very responsive to that, and they would like to see the data. That approach included a climate survey for LGBTQ+ students. We also had an additional survey for these students to share their satisfaction — or lack thereof — with the availability and accessibility of all-gender bathrooms on campus.We also held interviews with the LGBTQ+ center directors of peer and peer-plus institutions, including Tufts, Northeastern, Harvard, MIT and UMass Amherst. We conducted dozens of interviews with BU stakeholders who were either LGBTQ+ themselves or in a student support role — whether they were in health services or orientation, or the Center for Career Development — just to try to get a sense of what efforts were already in place to support LGBTQ+ students.Lastly, we had two comparative landscape analyses. One looked at criteria related to institutional LGBTQ+ support, and then another looked specifically at the academic side of things, looking at women's gender and sexuality studies programs and departments across the peer and peer-plus institutions.Rath:Tell us about the findings of the report and how that informed the kind of services you thought the centers should provide.Rose:Our findings show that, on average, LGBTQ+ BU students do not believe that BU's administrators provide a welcoming environment for LGBTQ+ students and that, on average, LGBTQ+ BU students are dissatisfied with the level of LGBTQ+ resources currently available at BU. And even further, 38% of students do not know of any LGBTQ+ BU resources available to them.Overall, our findings really show that the youth climate has taken a toll on LGBTQ+ students' mental and physical health, social life and academic performance. Our report makes several recommendations for what we hope the center would provide with those findings in mind.Some of those recommendations include assistance connecting students to culturally competent support resources, guidance and financial assistance with student-led advocacy and other initiatives, an emergency fund, mentorship opportunities, educational workshops and a physical space for students to hang out and study with their LGBTQIA+ peers.We really hope that, in addition to community building and having this physical space for community, policy advocacy and structural change are an integral part of the center's duties and would also emphasize throughout the report the necessity of an intersectional center that prioritizes the inclusivity and safety of our BIPOC [Black, Indigenous and people of color], trans and gender-nonconforming students.Rath:Building on that, the report addresses two main themes: improving visibility, communication and community, as well as making sure the overall student experience is more equitable and inclusive. What kind of changes would need to take place?Rose:In addition to this center, there really needs to be a university-wide climate shift. There need to be efforts across the entire university that are addressing the concerns and really aligning themselves with inclusive practices to better support LGBTQ+ students. We see the center as a critical first step in giving LGBTQ+ students the institutional support and visibility they deserve. But it really needs to be an effort that takes place across the university, split up based on department centers or offices. We really wanted to tailor our feedback to ensure that these specific centers and offices and departments knew exactly what they need to do to support LGBTQ+ students so that there was never a question of, ""OK, I see what some of the issues are, but what can we do?""Rath:What kind of reception have you had so far from the administration and the faculty?Rose:In November of 2022, we met with the president, provost and interim dean of students. We were really nervous going into that meeting and unsure what to expect because up until then, we had historically been met with a lot of resistance, especially from the dean of students' office, regarding our advocacy efforts and bringing concerns that LGBTQ+ students have and offering recommendations on how to address those.So going into this meeting, we really prepared for all kinds of scenarios, but we were actually super pleasantly surprised by how receptive and action-oriented they were from the start. President [Robert A.] Brown was basically like, ""OK, we're going to create a center. This is a no-brainer for us. Where do you want it to be?""There was a moment of just stunned silence from our task force because that was the question, maybe one of the very few questions that we were not anticipating for them to ask. We were, as I mentioned earlier, anticipating some resistance to our recommendations. But that's really not what we were met with at all, which was really, really surprising and great.",https://www.wgbh.org/news/education-news/2023-03-09/the-average-boston-university-lgbtq-student-feels-unwelcome-says-new-report,N/A - not specified
The COVID emergency is expiring in Massachusetts. What happens now?,"More than three years after the COVID-19 crisis prompted federal and state officials to declare public health emergencies, those declarationscame to an endtoday.With those expirations come notable changes to some policies and practices that have just become part of everyday life — as well as some changes that most people won't notice but that have been central to how government and health officials responded to the pandemic.Here’s what’s changing, and what isn’t, after May 11.Masking at medical facilities goes awayThe statewide mandate that all health professionals and visitors at hospitals, doctor's offices and other health care facilities expires. They still have the option to require masking, but many major hospital systems have announced that masks will be optional in most circumstances, including at Mass General Brigham, Tufts Medical Center, Boston Medical Center and Beth Israel Lahey Health.Masks are still required at Dana-Farber Cancer Institute.""At Dana-Farber, we see many people who have weakened immune systems due to illness or certain types of treatment, and face masks remain an important way to help protect these patients,"" the hospital said in a statement on its website.Masks are ""optional and encouraged"" across most of UMass Memorial Health in Worcester, but the hospital specified in a note to staff last week that it is requiring masks in emergency departments, oncology clinics, and with transplant patients.The masking requirement was not a national one. Dr. Robert Goldstein, commissioner of the Massachusetts Department of Public Health, said on Tuesday he believes Massachusetts was the last state in the country to require masking at health care facilities.""Neighboring states have similarly moved away from mandatory universal masking in health care and have pivoted to a strategy based on individual facility level criteria,"" Goldstein said at a press briefing. ""Importantly, as we make this change, we have also asked all health care facilities to develop a proactive plan that uses real-time data to identify when and where COVID-19 prevention strategies should be used, including a return to masking if necessary.""The state's decision to change the hospital masking policy has drawn protest from some activists, who say it puts immunocompromised people and many with disabilities in danger.“Universal masking has been a life saver for many people with disabilities,"" said Colin Killick, executive director of the Disability Policy Consortium in a statement. ""The fact that hospital mask mandates are being lifted this week ... will once again needlessly endanger the lives of those who are at greater risk because of their disabilities.""Rapid COVID-19 tests no longer covered by insuranceFor many, rapid antigen tests became a trusted way to return to something closer to a normal life while making sure not to spread COVID-19 to family and friends. That became especially true since early 2022, when the tests becameavailable from pharmacies with full coveragefrom insurance companies. As the emergency declaration ends, that mandated insurance coverage becomes a thing of the past.""People are going to be less likely to think about sniffles or coughs in light of COVID-19, and there will be a further barrier to getting tested because of the cost that these tests might involve,"" said Dr. Cassandra Pierre, associate hospital epidemiologist and medical director for public health programs at Boston Medical Center. ""And it's not a negligible cost.""Rapid antigen tests typically sell for roughly $10 each. Pierre noted the expense of the tests would be hardest for low-income communities who have already been disproportionately impacted by the pandemic.Goldstein, the state public health commissioner, said this week that the state has a ""cache"" of rapid tests and can make themavailable where needed.""We have over 2.5 million rapid tests available if someone were to need those — any health care facility or community,"" Goldstein said. ""We're going to have to think through how do we make sure that all of the community organizations have the tests that they need, that they had access to previously. They're not going to have the same stream that they had before and the same reimbursement that they had before. But we're working to make sure that everyone who needs a test or wants a test can have a test.""Less frequent data reportingStates are no longer required to share the same level of data related to COVID-19 cases that they've had to for the last three years, including daily reporting of new cases.Data on new cases had already become increasingly inaccurate as more people self-diagnosed using home tests, and wastewater data has become a more reliable metric for community exposure, Goldstein said. But there are also changes in other reporting requirements.""We'll see changes in the hospitalization reporting,"" Goldstein said. ""We were previously getting reporting on a daily basis and we'll shift to a weekly basis, which does make sense at this moment in this pandemic and will allow us to continue to stay up to date on what's happening in the hospitals.""The state will also report new vaccinations on a weekly basis, rather than a daily one, he said.""We're working through all of those changes to make sure that the information that's necessary for communities and for health care settings will continue to be available, accessible, understandable, so that they can make local decisions about what they need to do to protect themselves against COVID,"" Goldstein said.But some public health experts say they're concerned the changing data requirements will make it harder to track the virus's spread.""I do think that we will not have as much information to go on, when and if we decide it's time to pull back or reinstitute some of our former recommendations, for the good of both infection prevention in the hospital and infection prevention in the community,"" Pierre said.The reduced reporting requirements will make studies of vaccine effectiveness more difficult, said Andrew Lover, assistant professor of epidemiology at the School of Public Health and Health Sciences at UMass Amherst. That's because negative COVID tests will no longer have to be reported.""Those studies have been reasonably easy to run through testing sites, but they're going to be a lot more complicated now that the testing will be set up quite differently,” Lover said.Access to vaccines and therapeutics isn’t changing... yetFor years now, the federal government has bought and distributed doses COVID-19 vaccines and theraputics. The system is transition to a more commercial model, but that process hasn't started quite yet.""The timeline for commercialization is more towards the fall and winter of this coming year,"" Goldstein said Tuesday. ""And so on May 11th, folks can still go and get a vaccine wherever they were getting a vaccine before. And the cost of that vaccine will still fall to the federal government. So nobody should be limited in their access to vaccines.""But some local boards of health say they're worried about their future ability to continue offering vaccination clinics.""If we had a clinic tomorrow and I had 500 people show up, I could ask the state for vaccine and receive it,"" said Tim McDonald, director of Health and Human Services for the town of Needham.That's because the state has a stockpile of vaccines, McDonald said.""That is there until it's gone,"" he said. ""And the state projects [its supply] will last into September, potentially October. The state isn't getting any more for free from CDC. Once the state stops getting more for free from CDC, it doesn't give local [boards of health] any more for free. And locals have to then enter the commercial marketplace just like a CVS or a Walgreens, and try to purchase it at quite an expensive cost.""The cost of those vaccines would be reimbursed by insurance coverage, but getting the doses would require a significant up-front expense for local boards of health.""They'll get the money back. It'll come back, you know, nine to 12 months later, in insurance reimbursements,"" McDonald said, adding many cities and towns don't have the funds to foot that bill up front.Non-clinical spaces can still be used for testing and vaccinesDuring the pandemic, the state allowed hospitals to use non-clinical spaces for uses like testing, vaccination and other services related to the pandemic. Boston Medical Center, for example, set up a testing facility in a former restaurant.""And it was a godsend to be able to do that, because otherwise it would have been open-air tents, which would not have worked in the fall and winter,"" said Dr. Pierre.It was set to revert on May 11, but the state chose to extend the exemption.Ongoing expanded access to opioid disorder treatmentDuring the pandemic, the federal government loosened restrictions around the prescription of buprenorphine — commonly known by its commercial name, Suboxone — which is used to treat opioid use disorder and help prevent overdoses. Previously, doctors were required to see patients in-person before prescribing the drug, but a pandemic rule change allowed them to prescribe it following a telehealth visit.That option was set to expire with the emergency declaration, but the U.S. Drug Enforcement Agency has put that change on hold.""They got more than 30,000 comments in response to that proposed rule change,"" said Dr. Miriam Komaromy, medical director of the Grayken Center for Addiction at Boston Medical Center. ""So they're processing all of that, and they said we're going to take a pause and we're going to get back to you once we've thought this all through.""Komaromy said she regularly prescribes the drug, and the ability to do so by telehealth appointments is especially helpful for patients admitted to treatment centers that they can't easily leave.""This is a life-saving drug,"" Komaromy said. ""There's tons of evidence that this medication decreases risk of HIV, of hepatitis, of going to jail, helps people get back to work, helps prolong life, helps prevent overdoses. So super critical medication for people to have access to when they have opioid use disorder. So,we want to take away barriers to this medication and help people to have access to treatment.""",https://www.wgbh.org/news/local/2023-05-11/the-covid-emergency-is-expiring-in-massachusetts-what-happens-now,N/A - not specified
Black running groups call for change after police were called to their Boston Marathon cheer section,"Updated at 1:53 p.m. April 20SeparatorAt mile 21 of the Boston Marathon, thePIONEERS Run CrewandTrailblazHers Run Co.celebrated on Monday as each of their friends running in the race passed by.The two groups, who share a mission of spreading a love of running within communities of color, had set up a tent on Heartbreak Hill in Newton. For hours, they fired confetti cannons and stepped over a rope barrier to run alongside their friends, carrying banners with the running clubs' names.""We were having so much fun,"" said Mike Remy of PIONEERS Run Crew. ""And that all kind of came to an abrupt stop.""Police officers arrived at mile 21 and formed a barrier between the groups and the athletes running past, as well as stood on the street behind the cheer section. Newton Policehave characterized the response as a respectful effort to keep runners and spectators safeafter receiving complaints, but members of the running clubs say it was heavy-handed, disproportionate to police response elsewhere along the marathon route, and the result of systemic racism.The Boston Athletic Association, which runs the marathon, agreed to meet with the running groups Wednesday evening to discuss what happened. On Thursday, the BAA released a statement expressing regret.""It is our job, and we need to do better to create an environment that is welcoming and supportive of the BIPOC communities at the marathon,""the statement read.It's a tradition for the PIONEERS Run Crew to run alongside members who are competing in a marathon, said one of the group's captains, Aliese Lash.""In Chicago, in D.C., in New York, even in Berlin, we have this sort of moment of tradition of celebration,"" Lash said.Videos from Monday's race in Boston show groups of several spectators from the group running on the marathon with banners. But then, one of the crew leaders was approached by police as he got ready to greet a runner, Lash said.""An officer came up to him and grabbed him and pushed him into the crowd and said, 'Sir, let me see your I.D.,'"" Lash recalled.She said the officer then threatened to arrest the crew leader if he came on the course again.""And so we said, 'All right, like if we're not allowed to be on the course, we'll just stand behind the line like everyone else,'"" Lash said. ""And then shortly after that, there was a line of bike police who created a barrier between our group and the runners.""Photos andvideosof the moment show about a dozenpolice officers with bikes lined up along Commonwealth Avenue, facing the spectators in the two running clubs, as members of the groups questioned why they're there.Newton Police Chief John Carmichael said in a written statement that the police responded to a complaint from the Boston Athletic Association.""After being notified by the B.A.A three times about spectators traversing the rope barrier and impeding runners, the Newton Police Department responded respectfully and repeatedly requested that spectators stay behind the rope and not encroach onto the course,"" the Newton police chief wrote. ""When spectators continued to cross the rope, NPD with additional officers calmly used bicycles for a short period to demarcate the course and keep both the runners and spectators safe.""When asked for a response to the incident, the Boston Athletic Association released a statement that read, in its entirety, ""The B.A.A. is committed to creating a safe and enjoyable experience for athletes, volunteers and spectators across all our events.”""Our cheer zone was packed with runners and other athletes,"" said Mike Remy of PIONEERS Run Crew. ""So we wouldn't dream of doing something to impede somebody on the course.""For Remy and others in the group, the scene was shaped by its racial dynamics.""All I'm left with is, here is a cheering area primarily of Black and brown and Latin folk, and that's where we are being heavily policed,"" Remy said. ""I didn't see or hear any reports of things like that coming out of Wellesley, coming out of B.C. And having experienced those cheer zones in the past, I know what goes down there. You know, people there are drinking and boozing and real hard. People are crossing the street.""And, he said, people on the sidelines often jump onto the course to run with friends and family who are competing.""If it's going to be a hard and fast rule, then say it's a hard and fast rule, but enforce it everywhere.""For Aliese Lash, there was a clear explanation for what she saw as a disproportionate response.""I mean, my answer is systemic racism,"" Lash said. ""People seeing people who they're not used to showing up in their neighborhoods automatically jumping to biases and assumption that we're unsafe, that we're here to harm somebody, that we're drug dealers — whatever people say or think about when they see us. That is deeply embedded, and that's embedded in our culture, every corner of our culture.""Issues of racism are not new in the running world, Lash said, and the PIONEERS Run Crew exists to help runners of color find a place where they can feel included. Those issues are also why Lash serves on the steering committee for theBoston Running Collaborative, a BAA diversity initiative.""I'm a part of that group because they're committed to thinking about how we can make running more equitable and accessible to people of color,"" she said. ""And they share stories about how they want us to feel like we belong here, like we're welcome. But I also know that the Boston Marathon itself is a historically exclusive event that is incredibly difficult for people to enter in the first place, [and] that runs through the wealthy white suburbs of the city. And to us, especially us who are from Boston, we have to leave our city to come to Newton and then to be met with not feeling welcome, not feeling safe. It's so disappointing.""The BAA has agreed to meet with leaders of the PIONEERS Run Crew and TrailblazHers Run Co. this evening to discuss the incident, Lash said.""We have to be true to what's happening in our larger society. And this is just a representation of that,"" said Tiffany Chenault, a sociology professor at Salem State University and an ambassador for the Boston chapter of the running group Black Girls Run.Chenault also serves on the Boston Running Collaborative.Chenault, who was not at mile 21 on Monday, said the larger issue of systemic racism is a problem in the running world, and she'd like to see the BAA take more steps to address it.""I hope that they call it out,"" Chenault said. ""I hope that they put mechanisms in place, because the BAA is such a powerful organization, and that they take a stand on this,"" she said. ""So I'd be interested to see what they say and then what would they do moving forward. Because this puts a bad taste in many people's mouth.""SeparatorThis story was updated to include a quote from the BAA's statement released Thursday.",https://www.wgbh.org/news/local-news/2023/04/19/black-running-groups-call-for-change-after-police-were-called-to-their-boston-marathon-cheer-section,Black
