title,text,url,race_label
"RMV prepares for over 100,000 driver’s license applications from undocumented immigrants","The state is readying to meet the needs of more than 100,000 undocumented immigrants expected to apply for driver’s licenses in the first six months after a new state law goes into effect next month.Registrar of Motor Vehicles Colleen Ogilvie told GBH News this week that the state is ramping up preparations for the influx of new clients — as many as 1,700 a day — expected with the roll out of the Work and Family Mobility Act on July 1.“We have been working the last several months to add staff to our service centers, so that we have frontline staff that can accommodate more appointments,” she said. “The road test staff is about doubled. At the service center, we're adding about 45% more staff.”The new law allows eligible Massachusetts residents to apply to obtain a standard driver's license, regardless of immigration status, removing a previous state requirement that residents provide proof of immigration status. The law was passed after a contentious two decades of debate in the Legislature.“Between July and December, we expect that would have the greatest demand. So those increased staffing levels are here to help meet that,” Ogilvie said.The Registry of Motor Vehicles released a press release Wednesday detailing some of its plans with comments from various state officials, including Gov. Maura Healey.“The Work and Family Mobility Act is a benefit for public safety, for our economy, and for our immigrant residents who should be able to drive to work, school, or the grocery store without fear,” Healey said in a written statement. “We are grateful to the advocates, legislators and public safety leaders who have worked so hard to get us to this point.”A huge part of the undertaking is expanding language access in the Registry of Motor Vehicles as a whole. The office has been meeting weekly with a coalition, called Driving Families Forward, to hear from immigration advocates on how to improve services starting next month.Ogilvie says many new employees are multi-lingual and new phones are being installed in service centers to provide translations. “If we do have a customer that’s non-native English speaking, we can use the phone to call up an interpreter,” she said.There are 19 states with driver's license laws on the books for undocumented immigrants — Massachusetts was the 17th state to pass one. AGBH News investigation from 2019found that, in Connecticut, a similar law is credited with a reduction in hit-and-run crashes.State Rep. Christine Barber, one of the lead sponsors of the law, told GBH News that providing language acccess is key to making the process a success. Barber has participated in many community group sessions with the public to let people know what to anticipate as the law rolls out.“People are really excited and just grateful that this is finally happening,” she said. “The goal is to get more people insured and licensed on our roads.”Intererested new drivers will need to make an appointment to come in, state officials said; no walk-ins are available. Starting July 1, appointments can be made atMass.Gov/myRMV, and the office anticipates those filling up quickly. There is a special informational phone line currently available at 857-368-9362 with messaging about the law in English, Spanish, Portuguese, Mandarin, Haitian Creole and Vietnamese, with additional languages added soon. Driver’s license materials will be in 15 languages, permits in 35 and interpreters available in phone and in person in over 100 languages.The registrar’s office also is cautioning residents to be aware of fraud. Many nonprofits are reporting notary publics are advertising services where they stand in line for immigrants, expedite their applications and charge fees to let them know what documents are required.But that list isavailable for free online. “Customers needing credentials should never pay someone for an RMV appointment. There are no special brokers authorized to help you get an appointment or a license,"" state officials said in a press release. “Make sure that you pay fees only atMass.Gov/myRMVor in person at an RMV location.”In advance of July 1, $9.2 million was budgeted for start-up costs for the law in fiscal year 2023, and of that total, $4 million was payroll-related. Hiring will continue in fiscal year 2024. The fiscal year 2024 budget authorizes the RMV to spend $28 million for the new law and is authorized to spend up to $32 million.“We feel that we have the support we need to be successful,” Ogilvie said.",https://www.wgbh.org/news/local/2023-06-14/rmv-prepares-for-over-100-000-drivers-license-applications-from-undocumented-immigrants,N/A - not specified
Photographer Aïda Muluneh created public art for Boston's bus stops,"The other day, I was walking near a bus stop by the Common when I saw something interesting: At the bus stop, in that usual spot where you'd see an ad, there was this big, vibrant piece of art.But it wasn't actually a painting. It was a surreal photo with two women at the center painted white and wearing all black, sitting on these bright red chairs, vibrant blue and red and yellow hues behind them. There were eight other women in bright red cloaks who look like they're marching in a line behind them. Totally unlike anything you'd usually expect at a bus stop.I wanted to know why this weird and beautiful photo was here. So I called up the artist: Aïda Muluneh, a photographer and artist based in Abidjan, Côte d'Ivoire. She’s also a promoter of developing photography as an art form in Africa.The photo is part of a new public art installation in JCDecaux bus shelters in New York, Chicago, Boston and Abidjan. It's called“This is Where I Am.”“I have many memories of the cold winters in Canada having to take the bus to go to different places,” Muluneh said. “I think for a lot of people that take public transportation, it's an interesting way to engage them in looking at something outside of just advertising.”Muluneh, who was born in Ethiopia and grew up in Canada and Yemen, among other places, said the public art project appealed to her because it allowed her to bring her art to more people, as opposed to having it cloistered in an institution or gallery.Her work is often colorful, carrying a distinct visual language, she said.“I know I have a very distinct visual language, which took me a while to arrive to this point,” she said. “For those that see my work, it's something that they don't forget because it has its own approach.”She brings her subjects onto sets she builds, and works with teams of artists to make props.“I utilize a lot of my heritage, my culture. I do body painting,” Muluneh said. “It's the kind of work that you'll see from quite a distance. And there's a striking element to it.”This project is the first time in her career that she’s worked in a vertical format. Usually, she said, her works are square.“I liked that challenge because it took me out of my comfort zone to think in the vertical,” Muluneh said. “To try to imagine what I wanted to say that I've been saying within a square format, and to reformat into this different style.She and her team also enjoyed the process of making public art.“It's been really an open conversation on public art that really, I think, supports the artist's vision of what we want to say,” Muluneh said. “I enjoyed working with them because it's a conversation, and it's a negotiation that we have. But at the end of the day, for me, I look at intent. And the intent to me is really to bring a different form of art into the public that would not normally engage in it, and to also engage an audience that might not necessarily go into these galleries or go into these museums.”",https://www.wgbh.org/news/local-news/2023/03/20/photographer-aida-muluneh-created-public-art-for-bostons-bus-stops,African
Supporters claim racism led Everett to vote out popular superintendent,"Updated at 9:59 a.m. March 8SeparatorIt was an outcome predicted by many in Everett, a city that has been roiled bypolitical and racial tensions over several years.On Monday night the city’s school committee voted 6-4 not to renew Superintendent Priya Tahiliani's contract. She was considered a star among fellow superintendents and praised by community members, but Everett’s long-serving mayor was among those who voted her out.Tahiliani called the support she received at the meeting “overwhelming and heartening.”""As educators, everything we do is with the hopes of making some small impact. And last night, I felt reassured that I am doing my job. I will carry that encouragement and support with me through this difficult time,"" Tahiliani said in a statement.Tahiliani has served as Everett's superintendent since March 2020. As a woman of Indian origin, she was the first person of color to hold the post in a district where more than 80% of students are non-white and 89% of teachers are white.Just last year, she was awarded astatewide prizefrom the Massachusetts Association of School Superintendents. Her supporters, including M.A.S.S. Executive Director Tom Scott, said she'd brought needed stability to the school district after the previous superintendent wasconvictedof indecent assault of a school employee.Tahiliani had also received broadly positive feedback in school committee appraisals for the past two years. Mayor Carlo DeMaria was among those supporters in 2021 — but last year he was the lone committee member not to submit any appraisal.In January 2022, Tahiliani filed adiscrimination complaintagainst DeMaria, accusing him and others on the school committee of racism, sexism and interference with her work. And she alleged he was trying to “oust” her.The disconnect between the superintendent's positive feedback and committee members' critical views angered some members of the public at Monday's meeting, who blamed “old school politics” and racism for the decision.“Basically, as I see it, you have two choices. You have racism or anti-racism. Go back to the past or embrace the present and the future. You can use students, families and educators as pawns in your own internal squabbles. Or you can empower them,“ said teacher Shane McNally, addressing the committee before the vote.Several residents at the public microphone pointed to the influence of the mayor, now serving his sixth term in Everett.Resident Janice Lark called it ""a no brainer"" to renew Tahiliani and called for her opponents on the council to explain their positions.“The guy in the corner office does not want her here. We all know that,” Lark said. “Is it because her skin is brown? Is it because she's female? Is it because she's smart? What is it?”DeMaria did not explain his vote, but had made public his opposition to the superintendent in previous meetings. Others who voted no, like committee member Cynthia Sarnie, spoke of being harassed by members of the public and denied rumors that their votes had been bought. She also offered some specifics.“My vote would be based on the safety of the school and the cleaning and cleanliness of the schools,” said Sarnie.Marconi Almeida Barros, the lone member of color on the school committee, said Tahiliani had earned the committee’s support and reminded his colleagues they were the “voice” for students and families.“I don’t know how after listening to all of this, especially from students and parents, we would say no to the superintendent,” Almeida Barros said.Several students of color, like Everett high school junior Tiana Allen, came to the public microphone to explain why having Tahiliani in the role mattered.“When students see someone that looks exactly like them, holding amazing leadership skills and positions, it drives the students to do more,” said Allen, ”to reach for positions that felt so unbelievably out of reach... It means to drive Everett do more.”Tahiliani's current contract runs to March 2024.Qualified superintendents are in short supply nationally. According to M.A.S.S., the state currently needs to fill 45 of the 275 superintendent positions.Speaking to the school committee, Benjamin Murray, a teacher and member of his union’s negotiating committee made a dire prediction.""On the line is the future of the city, that is what’s on the line,” said Murray. “If you let her go tonight, you will not see another qualified candidate come across your table again.""SeparatorThis story was updated to include comment from Tahiliani.",https://www.wgbh.org/news/local/2023-03-07/supporters-claim-racism-led-everett-to-vote-out-popular-superintendent,mentions white people and people of color
Former Harvard chemistry professor sentenced to home confinement for China scheme,"A former Harvard chemistry professor convicted in 2021 of hiding his financial ties to the Chinese government will not spend time in prison.A federal judge in Boston sentenced Charles Lieber on Wednesday to six months home confinement and ordered him to pay a $50,000 fine.In a court appearance, Lieber, who had been one of the world's top chemists until his arrest, expressed remorse.“I regret the things that brought me here,” he said, wiping away tears. “I lost my job, my career and my freedom.”Prosecutors had asked for a three-month prison term for the 64-year-old academic, who was recently diagnosed with lymphoma. The government also argued that Lieber should pay a fine of more than $180,000, stating in court documents that he had “embarked on a years-long scheme to further his career through lies and deceit, while also lining his pockets courtesy of the Chinese government.”Federal officials arrested Lieber on Harvard’s campus as part of the China Initiative, an effort launched by the Justice Department under the Trump administration to counter academic espionage and theft of American intellectual property.A juryfound Lieber guiltyof lying to Harvard and the IRS about payments he received for participating in a recruitment program organized by the Chinese government.Lieber quietly resigned from his position at Harvard, where he had been on paid administrative leave.In pushing for a lighter sentence and home detention, Lieber’s attorneys argued that he didn’t knowingly lie to the government. They also said Lieber's late stage cancer diagnosis and weakened immune system would mean that any time he spent in prison would be “a death sentence.""",https://www.wgbh.org/news/education-news/2023-04-26/former-harvard-chemistry-professor-sentenced-to-home-confinement-for-china-scheme,White
He felt the slither of a venomous snake in the cockpit — then turned the plane around,"JOHANNESBURG, South Africa — Of all the things to go wrong midair in the cockpit of a plane, finding a poisonous snake under the pilot's seat must surely be one of the worst scenarios.So spare a thought for South African pilot Rudolf Erasmus.""I felt this little cold sensation underneath my shirt where my hip is situated — but basically where you've got your little love handles,"" he tells NPR.When he looked down, the pilot was surprised to see a highly venomous Cape cobra under his seat.Erasmus felt the slithering stowaway as he was piloting a private flight from South Africa's Western Cape to the northeastern town of Nelspruit on Monday.""As I turned to my left and looked down, I could see the head of the snake receding back underneath my seat,"" he says. ""At which point there was a moment of stunned silence, to be brutally honest.""Erasmus decided to turn the light aircraft around and make an emergency landing at the closest airport of Welkom.""I then informed my passengers of what was going on... but everybody remained calm,"" he recounted.A Cape cobra bite can kill someone in as little as an hour. Erasmus says his first thoughts were for his passengers.""I was more afraid of what the snake might do. Luckily it didn't strike anyone, otherwise that would have changed or complicated the whole situation,"" he says.The incident has drawn comparisons to the cult 2006 film Snakes on a Plane, in which an FBI agent played by Samuel L. Jackson lets loose an expletive-laden tirade when he discovers the plane he's on is full of venomous snakes.Erasmus says he'd seen the movie some time ago and the tirade was playing out inside his own head. ""That's how I felt at some point,"" he says, laughing.Erasmus has been praised by South African civil aviation commissioner Poppy Khosa, who called him ""a hero"" and said he ""saved all lives on board.""Since landing, however, the snake has not been found. It seems to have boarded (and disembarked, everyone hopes) on its own. [Copyright 2023 NPR]",https://www.wgbh.org/news/international-news/2023/04/05/he-felt-the-slither-of-a-venomous-snake-in-the-cockpit-then-turned-the-plane-around,N/A - not specified
"RMV prepares for over 100,000 driver’s license applications from undocumented immigrants","The state is readying to meet the needs of more than 100,000 undocumented immigrants expected to apply for driver’s licenses in the first six months after a new state law goes into effect next month.Registrar of Motor Vehicles Colleen Ogilvie told GBH News this week that the state is ramping up preparations for the influx of new clients — as many as 1,700 a day — expected with the roll out of the Work and Family Mobility Act on July 1.“We have been working the last several months to add staff to our service centers, so that we have frontline staff that can accommodate more appointments,” she said. “The road test staff is about doubled. At the service center, we're adding about 45% more staff.”The new law allows eligible Massachusetts residents to apply to obtain a standard driver's license, regardless of immigration status, removing a previous state requirement that residents provide proof of immigration status. The law was passed after a contentious two decades of debate in the Legislature.“Between July and December, we expect that would have the greatest demand. So those increased staffing levels are here to help meet that,” Ogilvie said.The Registry of Motor Vehicles released a press release Wednesday detailing some of its plans with comments from various state officials, including Gov. Maura Healey.“The Work and Family Mobility Act is a benefit for public safety, for our economy, and for our immigrant residents who should be able to drive to work, school, or the grocery store without fear,” Healey said in a written statement. “We are grateful to the advocates, legislators and public safety leaders who have worked so hard to get us to this point.”A huge part of the undertaking is expanding language access in the Registry of Motor Vehicles as a whole. The office has been meeting weekly with a coalition, called Driving Families Forward, to hear from immigration advocates on how to improve services starting next month.Ogilvie says many new employees are multi-lingual and new phones are being installed in service centers to provide translations. “If we do have a customer that’s non-native English speaking, we can use the phone to call up an interpreter,” she said.There are 19 states with driver's license laws on the books for undocumented immigrants — Massachusetts was the 17th state to pass one. AGBH News investigation from 2019found that, in Connecticut, a similar law is credited with a reduction in hit-and-run crashes.State Rep. Christine Barber, one of the lead sponsors of the law, told GBH News that providing language acccess is key to making the process a success. Barber has participated in many community group sessions with the public to let people know what to anticipate as the law rolls out.“People are really excited and just grateful that this is finally happening,” she said. “The goal is to get more people insured and licensed on our roads.”Intererested new drivers will need to make an appointment to come in, state officials said; no walk-ins are available. Starting July 1, appointments can be made atMass.Gov/myRMV, and the office anticipates those filling up quickly. There is a special informational phone line currently available at 857-368-9362 with messaging about the law in English, Spanish, Portuguese, Mandarin, Haitian Creole and Vietnamese, with additional languages added soon. Driver’s license materials will be in 15 languages, permits in 35 and interpreters available in phone and in person in over 100 languages.The registrar’s office also is cautioning residents to be aware of fraud. Many nonprofits are reporting notary publics are advertising services where they stand in line for immigrants, expedite their applications and charge fees to let them know what documents are required.But that list isavailable for free online. “Customers needing credentials should never pay someone for an RMV appointment. There are no special brokers authorized to help you get an appointment or a license,"" state officials said in a press release. “Make sure that you pay fees only atMass.Gov/myRMVor in person at an RMV location.”In advance of July 1, $9.2 million was budgeted for start-up costs for the law in fiscal year 2023, and of that total, $4 million was payroll-related. Hiring will continue in fiscal year 2024. The fiscal year 2024 budget authorizes the RMV to spend $28 million for the new law and is authorized to spend up to $32 million.“We feel that we have the support we need to be successful,” Ogilvie said.",https://www.wgbh.org/news/local/2023-06-14/rmv-prepares-for-over-100-000-drivers-license-applications-from-undocumented-immigrants,White
