text,link,race_label,race_discussed
"fresh off punching their ticket to the ncaa tournament, the boston university basketball team gathered at a restaurant near agganis arena to watch yesterday's selection show, anxious to learn its seeding, opponent, and destination.
the terriers received the no. 16 seed in the southwest regional and face top-seeded kansas on friday at 6:50 p.m. at the bok center in tulsa, okla. ``i haven't had this feeling in a long time, since i was at villanova and we were the last team in,'' said bu coach pat chambers. ``you're sitting there and you've got butterflies and . . . when you see we've got kansas, you're like, wow, we get to go to oklahoma and play kansas, what a great thrill for these guys, for this program, [and] for this university.'' the terriers (21-13), the only boston-area school in the field of 68, are riding an 11-game winning streak, culminating with their sixth america east title. the 56-54 win over stony brook gave the terriers their first trip to the big dance since 2002. ``we're passionate about the direction of this program,'' chambers said. ``this is going to be a thrill for us. i'm enjoying the spotlight.'' bu has never faced kansas, ranked no. 2 in both major polls. ``i just want [us] to compete,'' said chambers. ``i think we have a young group that hasn't reached their potential yet . . . i don't think we've really played up to our capabilities. i'm just hoping to come to practice tomorrow and get better and who knows? we are just going to compete, play hard, and on friday we'll see what happens.'' the terriers hope america east player of the year john holland continues playing like he did in the second half against stony brook. after a quiet start, holland (who averages 19.2 points per game) erupted for 23 second-half points to help bu overcome a 15-point deficit and earn the automatic bid. holland isn't feeling intimidated. ``we played kentucky. we played villanova, so i don't think it has anything to do with [us] being intimidated, it's just a matter of executing and hopefully you end up with the opportunity to do something special,'' he said. if bu stands any chance, holland will need some help from junior guard matt griffin, who has seen kansas suffer an ncaa tournament first-round upset in person. griffin watched his brother, john, help no. 14 seed bucknell stun the third-seeded jayhawks in 2005. ``it's something i've been watching since i was little,'' griffin said. ``i would run home from school just to see the first round. my brother played in it for two years, and i was fortunate enough to watch him. ``finally to get a chance to sit down and actually watch your own school get its name called, it's an unbelievable feeling.'' no 16 seed has ever won a game in the tournament. holland isn't ruling it out: ``it's got to happen eventually, so you never know.''",https://drive.google.com/file/d/1loBrWGxRLUP5AYPk6da3cON7eiSvBU_r/view,N/A - not specified,0
"music review sarah brightman at: the td banknorth garden, monday night for a former stage actress who likes to get gussied up like tinkerbell, engage in faux synchronized swimming routines, and pretend bicycle-ride through sinister forests straight out of tolkien, you would think sarah brightman would have more of a sense of humor. or sparkling charisma. or at least some sort of discernible personality.
but monday night at the td banknorth garden, the petite british diva was all business, focused on only two things: singing and costume changes. the former was incredibly impressive, as brightman hit glorious highs, belted out robust lows, and mixed up a variety of styles from light opera to pop over the course of the two act, hour-and-45-minute performance. it was all super-serious, full of portentous - and loud - synthesizers providing orchestral flourishes. but there was little variance in mood. a gauzy read of kansas's '70s hit ""dust in the wind"" received the same furrowed-brow treatment as the churning ""phantom of the opera"" and the soaring ""ave maria,"" an achingly beautiful duet with brawny-voiced tenor fernando lima from brightman's recent album, ""a winter symphony."" it was all perfectly pleasant yet strangely polite, like the pbs pledge-drive entertainment it will surely become. the fashion portion of the show was intermittently entertaining, with brightman burning through ball gowns and tutus and stilettos like a dress-up-happy 8-year-old. (although we wouldn't wish the bizarre antebellum hoop mini-skirt with 100-yard-train and lace-up fuchsia leggings on even the most desperate female impersonator.) apparently there was no room between hitting high c's and negotiating high heels for establishing a rapport with her audience of 4,173 - or with her cadre of backup dancers or the hard-working band hidden behind her whiz-bang stage set. brightman needn't channel cher to curry favor, but a smidge more interaction with the crowd - beyond a very proper thanks - or self-deprecation about her fairy princess persona would have warmed the proceedings considerably. perhaps brightman thought the imposing set - complete with an elaborate mirrored video screen capable of transmitting her picture-book 3-d backdrops - would distract from her own low-wattage stage moves, which consisted mainly of strutting down the extended runway, the occasional twirl in billowing skirts, and fluttering arm gestures. she also excelled at lying still on the floor as eight female dancers surrounded her, backstroking their way through routines that would've brought smiles to the faces of ziegfeld and esther williams.",https://drive.google.com/file/d/1L9bkTFEcwJ5bN8texmEvcJi8fFRAAlBP/view,N/A - not specified,0
"when vice president al gore's motorcade arrived at the sprawling hsi lai temple complex in southern california for a luncheon last year, his staff members openly described the event as a democratic ""fund-raiser,"" featuring party officials and asian-american contributors.  gore's own words and actions at the buddhist temple, witnessed by a globe reporter and described here for the first time, give credence to the vice president's assertion that while he knew there was a fund-raising component to the event, he viewed it more as a good-will visit with asian-american leaders.  although other party leaders warmed up the audience with political rhetoric, gore's remarks were non-partisan and restrained, markedly different from the biting one-liners he offered at another fund-raiser that evening in northern california.  at the hsi lai temple, gore spoke in personal terms of his acquaintance with hsing yun, the venerable master and leader of the temple and its growing worldwide congregation, and of the us tradition of tolerance for immigrant cultures. gore made no explicit pitch for contributions.
the hsi lai temple lunch will be featured when the senate campaign finance hearings resume today, with three nuns from the temple expected to testify that they served as conduits for tens of thousands of dollars of potentially illegal contributions from the church.  to defuse the controversy, gore's aides have mounted an aggressive defense of their boss - briefing reporters and releasing internal documents about the fund-raiser. after declining several requests during the past 15 months, gore's office agreed this week to release the globe from an off-the-record agreement that allowed this reporter to attend the fund-raiser, but that prohibited publication of details from the gathering. when the democratic fund-raising scandal broke last fall, gore said he thought the lunch had been a ""community outreach"" event. after the globe and other news organizations published the contents of memos from the vice president and his top aides that described the luncheon as a fund-raiser, gore acknowledged that he knew it was a ""finance-related"" event with traditional democratic donors invited.  but gore maintains that his staff did not tell him that the temple visit, which originally was scheduled as a non-political visit, had been transformed by mid-level party officials into a fund-raiser when plans for another southern california fund-raiser fell through. gore also says he did not know that temple members allegedly were pressured by those democratic officials to give tens of thousands of dollars in questionable contributions to the party after the luncheon and were then reimbursed by the taiwanese buddhist church.  the reporter accompanied gore on the marathon trip from washington to california on april 29, 1996, and interviewed the vice president on air force ii for a presidential campaign feature. the trip was packed with a variety of events, most prominently a midmorning speech to cable television executives in los angeles and a late-afternoon stroll with police on the beat in san jose. press secretary peggy wilhide and other members of gore's staff and security detail openly described two events on the day's schedule as ""fund-raisers"" closed to the press: the buddhist temple event in the los angeles suburb of hacienda heights and an evening reception in a private home in los altos hills, near san jose. upon request, gore's staff agreed to allow the globe into each occasion on an off-the-record basis.  after snarling traffic on the southern california freeways, gore's motorcade pulled up to the huge hsi lai complex shortly before 1 p.m. and was greeted by a high school marching band playing sousa tunes.  although the phrase ""buddhist temple"" might bring to mind a simple pagoda, the 15-acre hsi lai compound cost $ 30 million and includes a number of shrines and meditation halls, classrooms and conference rooms, a nunnery, a vip lodge, an auditorium, a museum, a large central courtyard, and two theme gardens with statues of arhats and bodhisattvas - buddhist holy beings.  the complex is the largest buddhist monastery in the western hemisphere. yun has built an international congregation of a million followers from his base in taiwan. gore first visited yun in taiwan in 1989 and then hosted the buddhist leader at the white house in march 1996.  gore's staff was warned to use ""great, great caution"" and to beware of a ""hidden"" taiwanese agenda in yun's dealings with gore, according to an april 19, 1996, memo from robert suettinger, a national security council official. yet the correspondence among the white house staff shows that gore's advisers and democratic finance officials repeatedly characterized the lunch as a prime fund-raising opportunity.  congressional investigators believe that two democratic party operatives, john huang and maria hsia, pushed to bring gore and the prosperous taiwanese buddhists together, arranged the luncheon, presided at the fund-raiser, and returned to the temple in the following days to press for contributions from nuns and monks who were later reimbursed by the church.  under state and federal law, non-profit institutions may not host partisan political events and retain their tax-favored status. individuals are prohibited from making political contributions in their own names only to be reimbursed by another individual or organization.  through statements issued by their attorneys, hsia and huang have denied any wrongdoing. in a statement to senate investigators released last month, yun accepted responsibility for the contributions from members of his temple but said his organization was only trying to honor gore and express its gratitude to the united states. he said the mistakes occurred because of a misunderstanding of us campaign laws. a prime question at the senate hearings will be what gore knew. gore says he knew the lunch guests were members of the democratic party's ""asian pacific american leadership council."" his briefing book that day noted membership in the group ""requires an annual contribution of $ 2,500 per person or $ 5,000 per couple."" his ""role"" at the luncheon was to ""extend appreciation for participant support and inspire political and fund-raising efforts among the asian pacific american community."" although representative robert matsui, a democrat from california, and don fowler, chairman of the democratic national committee, took turns thanking the audience for supporting the administration, gore chose not to use the partisan ""talking points"" from his speechwriters criticizing republican bob dole and house speaker newt gingrich. instead, gore and yun spoke of tolerance and religion. the vice president nibbled at his vegetarian meal, exchanged gifts with yun, posed for photographs with the 70 monks clad in saffron robes, and stood for a moment of reflection before a giant statue of sakyamuni buddha.",https://drive.google.com/file/d/18_eUfG4csMAq2l4heXuc36F-L2tz7JWk/view,Asian,1
"washington - former attorney general john ashcroft cannot be sued for his role in detaining an american muslim, even though the government did not charge the man with a crime or bring him as a witness in a terrorism investigation, the supreme court ruled yesterday.
justice antonin scalia said using the federal ``material witness'' statute to detain abdullah al-kidd as a material witness in a terrorism investigation does not give kidd a right to sue, because no court precedent had found such a use of the statute unlawful. ``qualified immunity gives government officials breathing room to make reasonable but mistaken judgments about open legal questions,'' scalia wrote. ``when properly applied it protects all but the plainly incompetent or those who knowingly violate the law. ashcroft deserves neither label.'' all eight justices hearing the case agreed that kidd's suit against ashcroft could not go forward; justice elena kagan sat out the case because she had worked on ashcroft's behalf as president obama's solicitor general. but there was disagreement about the government's action in the case and the treatment kidd received. kidd maintains that in his more than two weeks of detention, he was strip-searched, shackled, interrogated without an attorney present, and treated as a terrorist. justice ruth bader ginsburg, in a separate opinion joined by justices stephen breyer and sonia sotomayor, said kidd's ordeal ``is a grim reminder of the need to install safeguards against disrespect for human dignity, constraints that will control officialdom even in perilous times.''

",https://drive.google.com/file/d/13QadSlkaqIMGs5Byuop8wLslOKFWJGdX/view,N/A - not specified,0
"It's expected that virtually all home audio devices will be wireless by 2019.Left: Powerbeats3 from Dr. Dre's Beats. Below: SkyBuds If you were one of the many who moaned over news that iPhones — starting with the most recent model 7 — would no longer sport an old-school headphone jack, and would instead force you into the untested wild of wireless earbuds, I feel you. Even though I hated untangling those damn earphones, I loved the jack. I'm an analog guy at heart, with no problems with wires or cables, and plenty of skepticism toward the integrity of an audio signal scattered into bits and cast through the air.
 Trends in technology render me an outlier on this front. For one thing, HRA — high-resolution audio — is experiencing a boom right now in mobile devices and home listening systems. And wireless is playing an essential part; the consulting firm Futuresource predicts that ""virtually all home audio devices will be wireless by 2019."" For now, Apple is pushing its sizeable base of devoted users off the wireless cliff — and its recent joining of the Wireless Power Consortium hints at a forthcoming form of cord-cutting. This kind of suddenly open market has inspired a veritable hailstorm of wireless earbuds vying to knock Apple's proprietary Airpods out of your ears, which, honestly, isn't that difficult to do. Airpods, by the way, are actually pretty good. They boast crisp, clear, full sound; their connectivity with linked devices is solid and seamless; and the tap-based interface (to power on or off, or launch Siri) takes a familiar Appley approach to defining gestural standards for the rest of the field. As for battery life, they're good for 5 hours of listening — or 24 if you've got the charging case handy. (We know how these battery life love stories tend to end, however.) Despite a fair amount of teasing across the memescape, Airpods caught on big. But a whole gang of other buds are showing up, each with its own special something. Dr. Dre's Beats audio line, now a subset of Apple, came out with its own Bluetooth-enabled wirelesss headphones, the Powerbeats3. Designed for exercise and active use, the earbuds hook over the ears and tether behind the head. True to the Beats brand, they boast a broad, booty-friendly dynamic range, perfect for overpowering whatever garbage your spin instructor is blasting. Bose's similarly designed SoundSport headphones are also made specifically for distraction-free use during exercise. Coming from a company that made half my family look like air traffic controllers, the SoundSports feel like a step in the light direction. And while big brands like Sony, Sennheiser, and LG are all getting in on the action, some of the more intriguing entries into the bud-verse come from lesser known companies or ground-up crowdsourcing campaigns. Skybuds, for example, originally launched as a Kickstarter project that imagined a case for your phone that could also charge and store your earbuds. The final product features a more practical slim case design, and puts emphasis on clear sound and a snug fit. Bragi — the German startup whose identity-challenged The Dash headphones (another Kickstarter alum) made a big impact on the wireless world — has returned with its more focused sophomore effort, The Headphone. Notable for their sound quality and their easy (and smooshy) on-bud playlist and volume controls, The Headphone also sports a cool ""audio transparency"" feature, which doesn't so much quiet your music as diffuse it, allowing in a little bit of the world around you — including the cashier, who appreciates that. The Headphone hints at one of the more exciting opportunities to explore in the expanding wireless earbud space — augmented reality. The freshly released Here One system from Doppler Labs, for instance, doesn't just deliver high-quality streaming audio and phone calls through its Here Buds, it employs a connected app to let users filter and adjust the sound around them. That could mean using EQ controls to further dampen a noisy baby on a plane, or smooth down the squeal of the Green Line. It could also mean using one of a suite of ""smart audio filters"" that can tamp down a jet engine or boost a friend's voice at a noisy cafe. Early reviews suggest the Here One is still working out some kinks in connectivity quality (and it should be noted that all of these products, this whole wide wireless world, is still working out kinks), but the promise of this technology is more profound than just sunglasses for your ears. The next time your kids pop in their earbuds while you're talking to them, you can reasonably conclude they're listening more closely than ever. Michael Andor Brodeur can be reached at mbrodeur@globe.com Follow him on Twitter @MBrodeur.",https://drive.google.com/file/d/1hlaMcW7ljP9YrOa9vDohwxn-POr8qjM-/view,N/A - not specified,0
"the bruins are negotiating with edmonton for left wing shayne corson, but general manager harry sinden said there is only ""a slight chance"" a deal will be completed by tomorrow's trading deadline. ""they are shopping him,"" sinden said. ""and we inquired about him. they didn't turn us off.
""a lot of teams are trying to do something, and it usually picks up in the last 48 hours."" at least six teams have inquired about corson, who has scored eight goals in 34 games this year but was stripped of his captaincy after publicly questioning his benching by coach george burnett monday. chicago, st. louis and detroit are reportedly at the top of the list, with the blackhawks having the inside track. oates signing near  sinden said the bruins hope to sign adam oates to a contract extension soon. ""we are moving along with it and we hope to have something done in the next few days,"" sinden said after meeting with brian cook, oates' agent, yesterday afternoon. ""these are big deals and they don't get done overnight.""  cook said all major terms of the deal, which would extend through the 1998-99 season and be worth $ 11 million-$ 12 million, had been ironed out.  ""it's subject to adam's review,"" said cook. ""there are a couple of drafting points on harry's desk. the meeting was, as has been the case to date, two sides working with the same goal in mind."" sinden said the trading deadline would not affect negotiations with oates.  cook had wondered whether he would have to wait until after tomorrow's 3 p.m. trade deadline to sign because of the rumors that oates would be dealt.  ""i asked harry, 'do i need to wait until 3:01 friday?' "" recalled cook. ""he said no, that he wouldn't trade him. he gave me his word, and that's good enough for me."" kasatonov idled  alexei kasatonov missed practice with a slight leg injury . . . glen murray remained with the cam neely-oates line. ""glen was a big player down the stretch last year,"" sutter said. ""for whatever reason, he hasn't been this year, but the last three or four games, he has been one of our most visible players. he is a physical individual. the washington game was a physical game and he was one of the most visible players."" . . . sutter said wing mariusz czerkawski is returning to his early-season form. ""he has played more games this year already than he played in a season in europe,"" sutter said.",https://drive.google.com/file/d/1p4cDztX8eIYdh0vqj6OkRknwzVBXndvn/view,N/A - not specified,0
"upset that the big dig tunnel in which a ceiling collapsed had never been inspected, us representative michael e. capuano filed a bill in congress yesterday to mandate detailed inspections of all tunnels at least every two years.
capuano, a democrat from somerville who sits on the house transportation committee, said last night that he filed the bill in reaction to the july 10 ceiling collapse that took the life of milena del valle of jamaica plain. investigators quickly determined that the ceiling came down when a handful of bolts used to suspend it from the roof gave out. if inspectors had gone into the 5-foot-high crawl space above the suspended ceiling after the tunnel opened, they probably would have noticed bolts pulled out, perhaps alerting them to the danger of collapse, investigators have said. ""clearly, more must be done to ensure the safety of the traveling public,"" capuano said. ""apparently, if inspections are not required, they won't be done. this bill would require those inspections."" capuano's bill is modeled on the federal bridge program, which mandates inspections of bridges at least every two years. ""the bridge program means that when you drive over a bridge you know it's been inspected,"" he said. in the absence of a federal inspection program for tunnels, the massachusetts turnpike authority, which oversees the big dig, set its own inspection schedule. in the case of the interstate 90 connector tunnel where the collapse occurred, the turnpike had last inspected the ceiling in 2000, when it was built. the connector opened for traffic in 2003. but while state officials conducted a preopening safety check of the roadway surface and walls, no one got into the crawl space to view the hanger assembly that included the bolts. turnpike authority officials said after the collapse that they had been planning to inspect the connector later that summer, to fulfill legal obligations the authority assumed when selling billions of dollars in bonds to investors. turnpike officials interpreted their agreement with bondholders to mean that no inspection of the connector was required in 2003, its first year of use, when older sections of the big dig were inspected. after the ceiling collapse, investigators found 225 ceiling bolts in the connector that had pulled out of the roof at least a fraction of an inch, in addition to the 20 that had ripped out to cause the collapse. work crews have since abandoned the hanger assembly system that relied on epoxy to hold the bolts in holes drilled into the concrete roof. the new assembly system locks the bolts into place using grooves cut into the roof. also, officials have greatly increased the number of bolts carrying the weight of the concrete ceiling. capuano said he expected little opposition to the bill. he said the chairman of the transportation committee, james l. oberstar of minnesota, a democrat, had assured him of swift action.",https://drive.google.com/file/d/1dGbjkz4busAVw3W8AdQUAWjJETzlbeJC/view,N/A - not specified,0
