text,link,race_label,race_discussed
"racing to wrap up business before this year's session ends tomorrow, the house yesterday approved funding to create alternative sanctions programs for non-violent offenders, hire more state social workers and clear a backlog of cases involving special needs children awaiting adoption.  the alternative sanctions program, for which the house voted $ 11 million, would seek to rehabilitate offenders without incarceration - thus helping to relieve prison overcrowding. the vote would create alternative sanctions programs in suffolk, norfolk, hampden, briston and worcester counties.
""we can't build our way out of the problem and we can't punish our way out of the problem,"" said house speaker charles f. flaherty (d-cambridge), who championed the alternative sanctions idea.  rep. emanuel g. serra (d-east boston), who chaired a sentencing study committee appointed by flaherty, said it costs the state $ 30,000 a year to incarcerate an inmate, compared to about $ 6,000 a year for alternatives such as house arrest, electronic monitoring, community service or rehabilitation programs.  serra said statistics show that the recidivism rate is more than double among inmates who are released to the community directly from prison, compared to those who attend community corrections programs.  flaherty formed the study in response to a september globe spotlight team report which revealed that big-time drug dealers often bargain their way out of mandatory sentences by forfeiting drug profits, while first-time offenders are often given longer terms.  as part of a prison construction bond bill, the house is expected to vote today on another proposal from serra's committee that would give judges greater leeway to vary so-called mandatory sentences, providing they document why.  in a move to bolster the beleaguered department of social services, the house voted $ 4.9 million to hire additional social workers.  house ways and means chairman thomas m. finneran (d-mattapan) said the money will be earmarked for social workers to reduce caseloads.  gov. weld asked for $ 5.1 million in september to hire more than 100 new case workers, and an additional $ 8.8 million last month to help overburdened foster parents and provide more alternatives to traditional foster care.  yesterday the house voted to approve an additional $ 1 million to speed up the adoptions of special needs children who have languished in state care because of a lack of funding to process their cases.  another house vote would make it easier for the registry of motor vehicles to handle the unexpected costs of the ""sick building"" problems in its boston headquarters.",https://drive.google.com/open?id=1YOowlJ4aAlKxpOSHUVgig2aZob8UyLmh&usp=drive_copy,N/A - not specified,0
"a simple silver cross over the front door sets apart the red-brick building at the top of harbor street from others in the point, an immigrant neighborhood on the edge of downtown salem. st. joseph convent the last in a city that once had five has been home to catholic nuns since the first convent was built 112 years ago to serve st. joseph school and church. over time, three orders of nuns lived at the convent, teaching next door at the school.     the convent today is home to four sisters of the assumption of the blessed virgin, which has staffed st. joseph school since 1925. three of them sister fernande richard, sister yvette beauregard, and sister estelle grenier are true daughters of st. joseph. they grew up in the parish and went to the school there. a fourth, sister muriel lemoine, lives at the convent, but works as the campus minister at salem state college.
""it always seemed so special here,"" beauregard, 59, said softly, seated on a chair in the living room. ""when i was a young girl, i saw that the nuns were dedicated to their faith. they were happy. they were living together."" convent life at st. joseph may soon end. the three-story convent is expected to close, along with st. joseph church, some time over the next six months. the 131-year-old, french-canadian parish is among 65 scheduled to close as part of a massive reconfiguration of the archdiocese of boston. st. joseph school won't close, howev er. that will move across town to the old st. james school on federal street. the rev. lawrence rondeau, pastor of st. joseph, has appealed to archbishop sean p. o'malley to keep st. joseph open. in addition to the school, rondeau has cited the parish's thriving hispanic ministry, and a food pantry that serves 3,000 people each month in salem. if the parish closes, the sisters will lose their home. and salem has no other convent for them. other parishes closed or sold their convents amid a wave of catholic school closings in the 1970s. unlike parish priests, nuns do not work for the archdiocese. they work for their religious orders. ""we are not a diocesan community,"" said beauregard, the school's third-grade teacher. ""we belong to our congregation. . . . each parish with a school usually has a convent, but at st. james, there isn't one."" and if the convent closes, where will the sisters live? ""we don't know,"" said richard, 70, the school librarian. ""that's the honest truth."" since the parish closing was announced may 25, the sisters have spent much of their time consoling parishioners and reassuring parents that st. joseph school will stay open. they say they haven't had time to think about their own future. ""people here are upset,"" said richard, who grew up just blocks from the convent. ""we can't add to their burden. . . . i guess when the decision is final, we'll go see what's out there."" ""i know god will always take care of us,"" said grenier, 69, a special education teacher at the school. ""in the past, he always has . . . i cannot say i have lost my peace about this."" but st. joseph parents worry for the nuns' future. at a meeting last week to discuss the school move, a parent asked, ""what about our sisters?"" the sisters were asked to stand. they received a prolonged ovation from more than 100 parents and teachers that packed the school hall. monsignor paul v. garrity, the vicar for salem who ran the school meeting, didn't have an answer. ""it's one of those questions that really has to be looked at,"" he said. in an interview, garrity said the nuns probably will have to find their own housing. nuns involved in social work, health care, and other non-parish ministries often rent their own apartments. ""sisters today do receive a stipend,"" he said, adding he is sympathetic to the nuns. ""many of them come together to determine how they'll live."" the st. joseph nuns would like to stay together. ""this has been a wonderful community to be part of,"" said grenier, who moved to the convent 19 years ago. ""very good women live here."" but it may not be possible for them to stay together. a four-bedroom apartment or house is scarce. they also are expensive, particularly around st. james, which stands in the heart of the mcintire historic district, a neighborhood of stately federalist and georgian homes. ideally, they would like to be close to the school. the sisters, all of whom took a vow of poverty, pool their salaries. although they live rent-free at the convent, they pay for utilities, food, and other household necessities. each lives on a small budget to cover personal expenses, such as clothes and medications. when the school moves to st. james, the parish and school will pay their stipend. their order, too, will give them a stipend. but the sisters are still bracing for higher housing costs. ""it's going to be different,"" said richard, who takes care of convent finances. ""our order will help us some, but how much we're not sure."" although the sisters have quietly started asking around about apartments, they're prepared for the possibility that they may not be able to live together. ""the chances are not all of us will be together,"" said richard, who has lived at st. joseph for 33 years. ""we need space. we're used to having a whole house. . . . apartment living is going to be a big adjustment for us."" still, despite their own needs, the nuns remain focused on parish life. st. joseph serves salem's poorest neighborhood. more than half of its 900 families are hispanic, most of them immigrants from the dominican republic. the church has the only spanish mass in salem. it runs the largest food pantry. despite the many demands, the parish has no debt, parish officials said. the nuns thought st. joseph would survive the parish closings. they were heartened when o'malley said he would give special preference to parishes with schools, and serving new immigrants. ""when i heard that, i thought, 'we're out of the woods,' "" said beauregard. ""that's why this has all been so shocking."" they can't help but question the decision. ""i don't know what his [o'malley's] definition of poor is, if it is not here,"" richard said. ""i think these closings have not had any compassion for people,"" grenier said. ""from the start it has always been about buildings and property. that's where there has been no compassion."" beauregard has a special attachment to the convent. her uncle and father help build it in 1962, when the original convent had to be torn down. the new convent, with a private chapel and communal living space, had private bedrooms for 30 nuns. ""they built this house,"" she said proudly. and their quiet presence in the hardscrabble neighborhood has been a blessing. grenier discovered that on mother's day. as she was returning to the convent in the afternoon, a hispanic man in his 30s ran up to her. she recognized him as the man she waves to every day at the start of her 6 a.m. walk around salem. he gave her a big hug. ""he said to me 'happy mother's day, mom,' "" grenier said, a big smile on her face. ""i was so moved. nobody has ever said that to me. and he is just someone i wave to every day. i said to him, 'oh, my god. thank you. thank you.' ""     kathy mccabe can be reached at kmccabe@globe.com ",https://drive.google.com/file/d/1RiIUVRdxdnGRfLBtfjJZ5rPYYme_b3Uw/view,Hispanic,1
"Rykodisc's Jeff Rougvie worked with Bowie and will speak at the tribute. David Bowie departed planet Earth over a year ago, but his spirit lives on in Arlington on Friday, March 3, when the Regent Theatre hosts ""Celebrate Bowie,"" a multimedia tribute to the Thin White Duke.
Boston band The Daily Pravda will open the 2.5-hour show with Bowie tunes both popular and obscure. ""Expect everything from 'Ziggy' right up to 'Lazarus,' "" says Regent co-owner Leland Stein, who spent his teen years cruising in a 1959 Cadillac convertible listening to Bowie in the early 1970s. After the music, record exec and pop culture maven Jeff Rougvie takes the stage. He's one of the forces behind North Shore indie label Rykodisc, and he worked closely with Bowie on nearly 20 releases from 1969 until 1980, from ""Space Oddity"" to ""Hunky Dory"" and ""Low."" Rougvie will talk about Bowie's creative approach and reveal unseen material from his career. He'll also take audience questions. ""Hardcore Bowie fans will want to stick around for this,"" Stein says. Tickets are $17 in advance and $22 at the door. The show starts at 8 p.m. The Regent Theatre, 7 Medford St., Arlington, 781-646-4849, www.regenttheatre.com KARA BASKIN Kara Baskin can be reached at kcbaskin@gmail.com",https://drive.google.com/file/d/1Q7zY5vL179B0_tDF8kMMPilx0uN5CXd_/view,N/A - not specified,0
"KUALA LUMPUR, Malaysia — For years, North Korea has rattled the world with its nuclear tests and its threats to visit a nuclear holocaust upon the United States. Now, the finding by Malaysian police that Kim Jong Nam was assassinated with VX nerve agent is a stark reminder of the North's lesser-known weapons of mass destruction: a stockpile of chemical and biological weapons. Kim, the estranged elder brother of North Korea's leader, Kim Jong Un, was killed Feb. 13 when two women rubbed his face with the nerve agent at Kuala Lumpur International Airport, the police said Friday.
If North Korean nationals were indeed behind the killing, as Malaysian officials suggest, the use of VX raises several questions: Was the North Korean government using the attack to signal to the world its fearsome arsenal of such dangerous weapons? Or was the toxin simply an attempt to avoid detection in carrying out a brazen killing at one of the world's busiest airports? ""By using VX in an international airport in the heart of Asia, North Korea has sent a very clear message to the world that it will strike its enemies anywhere in the world,"" said Rohan Gunaratna, an expert on terrorism at the S. Rajaratnam School of International Studies in Singapore. ""It also demonstrates the North Korean response in the event of an attack against North Korea,"" Gunaratna said. North Korea's nuclear program has long been the most urgent concern of the United States and its allies, and the now-dormant six-party talks to curb the program did not address chemical and biological weapons. ""The reported use of VX reminds us that not only is the North's nuclear-missile threat serious but so are its asymmetric threats, including biochemical weapons and cyber that are all part of the regime's WMD tool kit,"" said Duyeon Kim, a Seoul-based fellow at Georgetown University's Institute for the Study of Diplomacy. South Korea's Foreign Ministry on Friday expressed ""shock"" at the use of a chemical weapon and vowed to work with the international society to deal ""strongly"" with the violation of the Chemical Weapons Convention. The deadly use of a chemical weapon banned by international conventions could strengthen calls for the United States to put North Korea back on a list of terrorism-sponsoring countries, analysts said. The North was first put on the terrorist list after its bombing of a South Korean airliner near Myanmar in 1987, killing all 115 people onboard. But the United States delisted the country in 2008 as part of an agreement aimed at ending North Korea's nuclear programs — a deal that has since disintegrated. After his announcement that Kim had been killed by VX nerve agent, Khalid Abu Bakar, the inspector general of the Malaysian police, said Friday that small amounts of the poison could have been brought into the country without being discovered. Two women have been arrested in the killing, one from Indonesia and the other from Vietnam. The attackers could have used a safety-enhancing battlefield form of the agent. Known as VX2, it is divided into two compounds that are harmless individually but become lethal when mixed together. If Kim's two assassins had each applied one component of VX, this would explain why two assassins were needed, how they survived the attack, and perhaps why it took 15 minutes or more for Kim to die. ""Use of a binary nerve agent lends itself to this method and allows for a potentially highly targeted hit,"" said Vipin Narang, an associate professor of political science at the Massachusetts Institute of Technology who has two degrees in chemical engineering. Narang said it was clear that North Korea wanted the West to know what it is capable of — but without causing mass casualties. ""They wanted everyone, especially the US, to know it was VX and that they can make it or have it,"" he said.",https://drive.google.com/file/d/1u83cJPHMArk_vpec1GlqPiHS03NtbGXS/view,Asian,1
"frederick j. quinlan of west roxbury, a retired supreme judicial court clerk, died yesterday at st. john of god hospital in brighton. he was 67.
mr. quinlan was a lifelong resident of boston. he graduated from boston college high school and boston college. he also earned a degree from northeastern university school of law in 1953. he served as an officer in the air national guard in the 102d fighter wing based at logan airport, and later with the office of special investigations. mr. quinlan formerly worked with lyne, woodworth & everts and later with attorney robert o'reilly. he was named assistant clerk of the supreme judicial court in 1959 and later promoted to clerk. he served with three of the sjc's seven justices on the hearing list committee and was clerk treasurer of the judge's library corporation. he worked closely with the rules committee in creating and implementing the massachusetts rules of civil, criminal and appellate procedure. he retired in 1995, having served under four chief justices. after retirement, he volunteered at faulkner hospital and the west roxbury va hospital. he leaves his wife, anne (fraher); a daughter, ellen of west roxbury; a brother, paul of vernon, conn.; and a granddaughter. a funeral mass will be said tuesday at 10 a.m. in st. john chrysostom church in west roxbury. burial will be in st. joseph cemetery in west roxbury.",https://drive.google.com/file/d/1-Fsh1vQaW7cHClFipj91mL4sxRRE9nMc/view,N/A - not specified,0
"The shelter received thousands of inquiries about Phil after the dog was left in a crate by the side of a Hingham road.
 The Maltese dog that was abandoned in a crate by the side of a busy road in Hingham last month was adopted Thursday from the Animal Rescue League of Boston. The dog had been renamed ""Phil"" by the Animal Rescue League. The shelter said it received thousands of inquiries about Phil from across the country. Before he was allowed to be adopted, the veterinary staff at the shelter gave the 2-year-old dog a full exam. ""While skittish upon intake, the friendly pup was quick to warm up, showing off his energetic personality to ARL staff and volunteers,"" the shelter said in the release. The person who abandoned Phil has not been found, the Animal Rescue League said. Maddie Kilgannon can be reached at maddie. kilgannon@globe.com",https://drive.google.com/file/d/1_mblvrk41j9_KeTk0kXipoSc5z8P9871/view,N/A - not specified,0
"those among us with celtic memories extending further back than darren daye may recall that during its e. ellis (woody) erdman stewardship, the franchise was so destitute, airlines and hotels routinely refused it credit. the current management cavalierly plunks down multimillions for the television station where ""mcmillan and wife,"" ""columbo"" and ""private benjamin"" have gone to die. i mean, channel 25 has never been in what you might call the cathode ray playoffs. welcome to the '90s. that, in fact, is what celtics chairman of the board don gaston said yesterday while announcing the team's purchase of the station. he's going to put all his road games on his own station, and he thinks you'll see a lot more of this in the future.
teams have formed cable stations. you've got the red sox and nesn, the lakers and prime time, and a few other examples. but this is the first time a professional sports team has purchased a ""free"" tv station for the purpose of producing its own telecasts. obviously, messrs. gaston, alan cohen and paul dupee think this is an eminently logical business proposition. it's all heady stuff if, like me, your biggest exposure to the business world was a kool-aid stand in front of your house when you were 10. people keep telling us that the worlds of athletics and entertainment are becoming indistinguishable. who can doubt it now? the players may not know it, but the boys up top already have those aftra applications in the mail. the time is past when celtics players, coaches and management personnel can justify their salaries solely by playing basketball. imagine the look of channel 25 programming a year from now: 7:30 casting with kevin who needs gaddabout gaddis? fishing (and hunting) enthusiasts can tune in for the next 10,000 weeks as kevin mchale takes viewers on a tour of each and every one of his home state's lakes. see lucky contestants vie for prizes by taking jump hooks at special floating backboards. 8:00 mr. rodgers' neighborhood the pilot's a pip. mr. rodgers is a new head coach. a couple of games into his inaugural season, his best player goes down for the year. after the draft, he goes off on a peaceful vacation in the woods with his brother and friends to unwind. no phone. no beeper. totally incommunicado. he comes home after a week to find out that his prize rookie point guard has accepted a million-dollar offer to play in italy. yeah, it is unbelievable, but they figure if you'll buy a 16-year old doctor, you'll buy anything. 8:30 jurisprudence with jan each week, celtics general manager jan volk is presented with a hypothetical sports law case that he must clarify for the masses by using the greatest number of polysyllabic words and compound-complex sentences. 9:00 hello, larry the once-shy hoosier has blossomed sufficiently to host his own talk show. guests on the first program will include moses malone (get ready for the banter on the '81 playoffs) and bill laimbeer. larry bounces one-liners off a guffawing rick robey, who loves to reminisce about his favorite sneakaway dunks and steak dinners. a special feature will be the alumni corner, one of the highlights being garfield smith's animated discussion of his famed 1970 air ball hat trick from the free throw line in phoenix. 10:00 arnie's angst he used to coach the team, and he remembers when it was a simpler world. he also was the general manager, the traveling secretary, team psychiatrist and accountant. he didn't know from assistants, and all he did was win every year. now they've got about 18 people to do what he once did. he goes to the league meetings and all they talk about are luxury boxes, balance sheets and audience shares. he's disoriented. ""doesn't anybody wanna talk basketball?"" he wails. (viewer discretion advised. contains occasional profanity, excessive cigar smoking and horrifying doses of chinese food.) but seriously, folks . . . buying channel 25 may be a great idea. gaston, cohen and dupee are believed to have pocketed many, many millions when they put 40 percent of the team up for sale a few years back, and no one can accuse these guys of being financially naive. if nothing else, you've got to like the commitment to boston. but what do i know? my kool-aid stand usually went into receivership.",https://drive.google.com/file/d/1JtcVcLBTbSG4CtqvfEJCgmq5RNDBSyAL/view,N/A - not specified,0
"The J.C. Penney Co. on Friday said it plans to close between 130 and 140 stores in the next several months, a move that makes it the latest retail stalwart to pull back from the mall amid the rise of online shopping.
The department store giant's latest quarterly results, also released Friday, illustrate its struggle to connect with shoppers: Sales were down 0.7 percent at stores open more than a year. And yet the report also demonstrated that the chain, unlike department store rivals such as Macy's and Sears, has had improving momentum lately. The company managed to deliver a net profit in 2016, the first time it has done so since 2010. J.C. Penney's decision to close stores comes as many industry executives and analysts say that old-school chains are ""overstored,"" meaning they have too many locations for the era of online shopping. Macy's is in the process of closing 100 stores and eliminating some 10,000 jobs. Sears said in January it would close 150 stores, some from its namesake chain, and some from the Kmart chain. Marvin Ellison, the company's chief executive, said in a statement that J.C. Penney is slashing stores because ""we believe we must take aggressive action to better align our retail operations for sustainable growth."" The company is set to disclose in mid-March which locations it is to shut down. J.C. Penney said the affected stores account for less than 5 percent of total sales. It expects the closures will result in $200 million of annual cost savings. It is not clear exactly how many jobs will be affected by the closures. The company says it will offer a voluntary early retirement package to 6,000 employees. WasHington Post",https://drive.google.com/file/d/1eUzHGlGQwzClleH2QNXQl1fh9a0NeWMc/view,N/A - not specified,0
