text,link,race_label,race_discussed
"friends and foes agree on this much about stephen p. tocco: the man sure can make trouble, but he knows how to make nice. after sparring and nearly reaching the point of no return with a challenger, the chairman of the state board of higher education is known to flash his impish smile, let loose his low-key humor, and deflate explosive situations of his own making. ""i was livid,"" said representative kevin murphy, house chairman of the joint committee on higher education, who said tocco blindsided him last fall by publicly rolling out a financial aid proposal without consulting him. ""but he said he wanted a heart-to-heart. when our meeting was over, i said, `this is a guy i can work with.' "" now, as tocco, 59, seeks to win the chairmanship of the university of massachusetts board of trustees, the question is whether his aggressive style would propel umass-amherst into a top-flight flagship or bog down the board in one-upmanship and recriminations.
tocco vies for the spot amid controversy. he says he has the votes to unseat karl white , the chairman, at a special meeting set for thursday, but others say his election pushed by governor mitt romney is not a fait accompli. tocco, whose style has made him a go-to man in successive republican administrations, says he must act as a consensus builder to be successful among the 19 voting members on the umass board. but during an interview in his 41st-floor office in downtown boston, tocco said he is prepared to do battle to fulfill romney's mandate to elevate the profile of umass-amherst by improving its campus and its national rankings. ""umass-amherst becomes the brand of the public system,"" tocco said. critics, higher education officials who would talk only off the record about their concerns, say tocco's plan could put the five campuses, which now act like miniempires, on a collision course. while some say that tocco owes his ascension to the umass board to his close political ties to romney, others contend that tocco has become well-versed in higher education policy in the seven years he has headed the state board of higher education. state officials and educators credit him for pushing through key initiatives, including improving state and community college graduation rates. the initiative initially met with resistance, but college officials say tocco was dogged and eventually swayed college leaders. state college graduation rates in the past three years have gone from 44 percent to 49 percent. ""there has been tension between tocco and the president of the institutions,"" said dana mohler-faria, president of bridgewater state college. ""but it was the sort of tension that caused the system to move forward."" robert antonucci, president of fitchburg state college, put it this way: ""steve is steve. he's upfront, he's honest. sometimes he may step on toes, but to get the system moving, you can't be a fly on the wall."" tocco says the clash over graduation rates was necessary. ""the college presidents said i was supposed to be their advocate,"" he said. ""i said, `i can't be an advocate if i don't believe in the product.' "" tocco grew up in malden and later reading, the son of a milk delivery man and stay-at-home mother. the oldest of five children, tocco was an avid athlete at reading high school and carried himself with an intense demeanor, his siblings recall. ""god love him,"" said mary cookson, his sister. ""he was never afraid to take the bull by the horns."" tocco earned a bachelor of science in pharmacy and chemistry from the massachusetts college of pharmacy in 1969, although tocco says he never intended to make a career in pharmacy. he developed an interest in public policy in 1976 when he campaigned for his childhood friend, edward j. markey, as he sought his first term in congress. tocco soon after began running markey's district office. ""steve was a natural leader,"" markey said. ""he could take any issue and work with people to try to reach consensus."" in 1980, tocco left politics to head associated builders and contractors, a trade association. eleven years later, he returned to politics as a senior aide to governor william f. weld, who, a year later, named tocco secretary of economic affairs. in 1993, weld tapped him to head the massachusetts port authority, where he stayed for four years, and clashed with then-senate president william m. bulger over how a sports and convention center would be paid for and designed. in 1997, he joined an international trade unit of the law firm mintz levin cohn ferris glovsky and popeo, and two years later, became head of the firm's lobbying arm, ml strategies, after its merger with the trade unit, the same year he was tapped to head the state board of higher education to critics, tocco's dual role, as higher education czar and head of a lobbying firm of a law firm that touts higher education as a specialty, is a collision of interests. ""a person in that position has to be able to stand up and advocate for the wishes of the university against the wishes of the governor and the legislature, and i don't know if you can do that if you are in the position that steve tocco is in as president of ml strategies,"" said james karam, the umass board of trustees chairman who was ousted by romney this month. umass trustees oversee a budget of $2.1 billion. tocco says he has sought to avoid conflicts of interest and has recused himself from board of higher education votes that awarded his law firm work as legal counsel to umass as it secured financing for construction. tocco does not register as a lobbyist because he says he runs ml strategies, but does not lobby on its clients' behalf. he said ml strategies, which has five registered lobbyists, does not represent any institutions of higher education. state records show the firm represented boston university in 2004, but tocco says it no longer does. tocco declined to provide a client list. ""he doesn't have a self-interested agenda,"" said robert o'leary of the cape and islands, who is the senate chair of the joint committee on higher education. ""he really is an advocate for the system."" tocco still lives in reading with his wife, cynthia bouthot tocco, who works for the british consulate, and has three grown children. in his spare time, he said, he plays golf in reading. but he says that time is limited: there is always background reading. tocco says he's gearing up for clashes anew if he wins control of the board. ""disagreement is healthy,"" he said. ""if everyone agrees, i worry that i missed something."" sarah schweitzer can be reached at schweitzer@globe.com. sidebar: mixed grades stephen p. tocco has made a career of pushing bold proposals and fighting off naysayers. he's offended many in the process, and at times his proposals have failed. failing in 1993, as head of massport, tocco spearheaded an effort to build a stadium in downtown boston. ticked off: legislators, including senate president william m. bulger, who opposed the deal. result: proposal was dead-on-arrival in the legislature. in 1988, as head of associated builders and contractors, tocco led a campaign to repeal the state's prevailing wage law. ticked off: organized labor. result: referendum defeated; tocco received a black funeral wreath with a note attached wishing that he and his campaign ""rest in peace."" passing in 2004, as head of the state board of higher education, tocco demanded that state colleges raise graduation rates. ticked off: state college presidents, who said tocco was not taking into account factors beyond their control. result: college graduation rates have increased from 43 percent to 49 percent in the past three years. incomplete in 2005, the state board of higher education, with tocco as its head, rolled out a financial-aid overhaul proposal. ticked off: legislators, who were not informed beforehand. result: tocco mollified legislators by meeting with them; plan remains a work in progress.",https://drive.google.com/file/d/1TjdCFopoXBLr-RWMI6X5wzBX4Ps4Lfty/view,N/A - not specified,0
"president beji caid essebsi said the bardo museum attack involved three men, one of whom escaped. tunis — a third attacker in the deadly assault on the bardo museum is on the run, tunisia's president said sunday, declaring his country at war with the extremists who killed 21 people at one of north africa's most revered cultural institutions.
president beji caid essebsi said the attack involved ""three aggressors"" and the third person escaped. he was speaking live with french network itele from inside the museum, its elaborate tilework visible behind him. tunisia's interior ministry released security camera footage of wednesday's attack showing two gunmen walking through the museum, carrying assault rifles and bags. at one point they encounter a third man with a backpack walking down a flight of stairs. they briefly acknowledge each other before walking in opposite directions. police responding to the attack shot and killed the two gunmen. they were identified as tunisians in their 20s who had trained in libya. essebsi said the extremists who have recruited about 3,000 tunisians to fight in iraq and syria have no credible link to islamic belief. he said his country was at war with them. ""when war is brought upon us, we will wage war,"" he said. spanish tourist josep lluis cusido said he never got a clear look at the men shooting their way across the bardo museum as he hid behind a pillar. but he noticed that the attacker closest to him seemed young. cusido, mayor of the spanish town of vallmoll, will never know for certain but the man who stood a few yards away was probably 20-year-old yassine laabidi — the younger of the two attackers. ""they looked to see how they could inflict the most damage possible. i saw one group who was in the museum who took refuge in a room . . . they went in there and machine gunned them all,"" cusido said saturday, stifling a sob. after breakfast wednesday, laabidi left home to go to his job making deliveries for a local business, his father arbi said in their home in el omrane, an area on the outskirts of tunis. later that day he joined 26-year-old hatem khachnaoui and shot 21 people to death at the renowned museum — including a tunisian security agent who had recently become a father — before being killed in a shootout with security forces. in el omrane — a poor neighborhood that has proved fertile ground for jihadi recruiters — a mourning tent went up outside the laabidi home. ""we want to know who transformed him, who brainwashed him so that he went to kill innocent people. we have to find the people who are sending our children to death and setting our country adrift,"" said his brother, khaled.",https://drive.google.com/file/d/1DSv8RgG5sPymsiKovtuGopC4NlxUzjje/view,N/A - not specified,0
"It's expected that virtually all home audio devices will be wireless by 2019.Left: Powerbeats3 from Dr. Dre's Beats. Below: SkyBuds If you were one of the many who moaned over news that iPhones — starting with the most recent model 7 — would no longer sport an old-school headphone jack, and would instead force you into the untested wild of wireless earbuds, I feel you. Even though I hated untangling those damn earphones, I loved the jack. I'm an analog guy at heart, with no problems with wires or cables, and plenty of skepticism toward the integrity of an audio signal scattered into bits and cast through the air.
 Trends in technology render me an outlier on this front. For one thing, HRA — high-resolution audio — is experiencing a boom right now in mobile devices and home listening systems. And wireless is playing an essential part; the consulting firm Futuresource predicts that ""virtually all home audio devices will be wireless by 2019."" For now, Apple is pushing its sizeable base of devoted users off the wireless cliff — and its recent joining of the Wireless Power Consortium hints at a forthcoming form of cord-cutting. This kind of suddenly open market has inspired a veritable hailstorm of wireless earbuds vying to knock Apple's proprietary Airpods out of your ears, which, honestly, isn't that difficult to do. Airpods, by the way, are actually pretty good. They boast crisp, clear, full sound; their connectivity with linked devices is solid and seamless; and the tap-based interface (to power on or off, or launch Siri) takes a familiar Appley approach to defining gestural standards for the rest of the field. As for battery life, they're good for 5 hours of listening — or 24 if you've got the charging case handy. (We know how these battery life love stories tend to end, however.) Despite a fair amount of teasing across the memescape, Airpods caught on big. But a whole gang of other buds are showing up, each with its own special something. Dr. Dre's Beats audio line, now a subset of Apple, came out with its own Bluetooth-enabled wirelesss headphones, the Powerbeats3. Designed for exercise and active use, the earbuds hook over the ears and tether behind the head. True to the Beats brand, they boast a broad, booty-friendly dynamic range, perfect for overpowering whatever garbage your spin instructor is blasting. Bose's similarly designed SoundSport headphones are also made specifically for distraction-free use during exercise. Coming from a company that made half my family look like air traffic controllers, the SoundSports feel like a step in the light direction. And while big brands like Sony, Sennheiser, and LG are all getting in on the action, some of the more intriguing entries into the bud-verse come from lesser known companies or ground-up crowdsourcing campaigns. Skybuds, for example, originally launched as a Kickstarter project that imagined a case for your phone that could also charge and store your earbuds. The final product features a more practical slim case design, and puts emphasis on clear sound and a snug fit. Bragi — the German startup whose identity-challenged The Dash headphones (another Kickstarter alum) made a big impact on the wireless world — has returned with its more focused sophomore effort, The Headphone. Notable for their sound quality and their easy (and smooshy) on-bud playlist and volume controls, The Headphone also sports a cool ""audio transparency"" feature, which doesn't so much quiet your music as diffuse it, allowing in a little bit of the world around you — including the cashier, who appreciates that. The Headphone hints at one of the more exciting opportunities to explore in the expanding wireless earbud space — augmented reality. The freshly released Here One system from Doppler Labs, for instance, doesn't just deliver high-quality streaming audio and phone calls through its Here Buds, it employs a connected app to let users filter and adjust the sound around them. That could mean using EQ controls to further dampen a noisy baby on a plane, or smooth down the squeal of the Green Line. It could also mean using one of a suite of ""smart audio filters"" that can tamp down a jet engine or boost a friend's voice at a noisy cafe. Early reviews suggest the Here One is still working out some kinks in connectivity quality (and it should be noted that all of these products, this whole wide wireless world, is still working out kinks), but the promise of this technology is more profound than just sunglasses for your ears. The next time your kids pop in their earbuds while you're talking to them, you can reasonably conclude they're listening more closely than ever. Michael Andor Brodeur can be reached at mbrodeur@globe.com Follow him on Twitter @MBrodeur.",https://drive.google.com/file/d/1hlaMcW7ljP9YrOa9vDohwxn-POr8qjM-/view,N/A - not specified,0
"gerhard lauck works hard to dispel people's assumptions about neo-nazis: he laughs frequently, makes self-effacing jokes and stresses that he promotes only nonviolent change. ""i'm just a big, kind, lovable teddy bear,"" he insists. civil rights and law enforcement officials around the world, particularly in germany, describe this american citizen in other terms: as an evil, dangerous provocateur. they say, and lauck agrees, that he is the no. 1 producer of neo-nazi propaganda distributed in germany, where even the possession of such material is outlawed. indeed, after quietly producing his wares for two decades in america's heartland, lauck is being thrust into an international spotlight by the post-reunification surge of neo-nazi activity in germany, and his role in promoting it.
lauck, during a two-hour interview near his home outside lincoln, maintained that his mission was just to help white people understand their interest in installing a fourth reich through electoral means. but german authorities say that his efforts have been anything but democratic, and that they fueled racial hatred and fomented violence. for instance, they said inflammatory stickers, newspapers and other materials traced to lauck were found during investigations of more than 70 hate crimes in 1991. and his influence, by all accounts, has mushroomed. while his background is somewhat sketchy, it is known that in 1972, lauck, at age 19, founded the national socialist german workers party-overseas organization, which has an estimated membership of fewer than 500 in this country. with the exception of the last two words, the group's name is identical to that of adolf hitler's nazi party. lauck subsequently engaged in a host of neo-nazi activities in the united states and abroad, but he has become most successful publishing a newspaper called ""the new order,"" printed in 10 languages. it includes virulent attacks on minority groups and jews. it features ads for nazi literature, tapes and cassettes of hitler's speeches, and it offers suggestions on how to smuggle such material into countries that prohibit its existence on their soil. fbi director louis freeh promised last month during a trip to germany to crack down on us purveyors of neo-nazi writings and paraphernelia. he did not cite lauck by name, but officials in both countries said in interviews that he was the chief target of freeh's vow. the officials acknowledged that pinning lauck down for a specific crime may prove difficult, however, since he and others often operate from this country expressly because of its constitutional protections. ""the problem is that his activities are not illegal in the united states,"" said susanne karkowski of the bundesamt fur verfassungsschutz, the german equivalent of the fbi. ""it's not for nothing that he operates from somewhere where he finds himself in a legal nirvana."" lauck does not reveal the location of his printing presses or the identities of his coworkers (""they have wives and children""). armed with the first amendment, he generally wages his international battles from close to home. he also sells his products domestically, but us officials dismiss his activities here as insignificant compared with their impact in germany and, to a lesser extent, in the splintered states of the former soviet union. ""it's one thing for this material to be distributed in new york, where there's so much of this kind of stuff and people are used to fringe politics, for example, but it's another thing for lauck's propaganda to act as virtually a match in the tinderboxes of central and eastern europe,"" said tom halperin, who along with irwin suall is director of fact-finding for the anti-defamation league of b'nai b'rith. dressed neatly in dark gray slacks, light gray sportcoat, white shirt and gray-striped tie, lauck repeatedly sought during an interview last week to stress a preference for nonviolence. the bloodthirsty images that the ""jewish-dominated media"" and ""germany's dictatorship"" seek to create, he said, are false and distorted. as if to underline his point, lauck presented even his most strident views in moderate tones, laced his comments with historical and literary references, and projected an affable persona. but the examples he cited of his good intentions belied the self-image he sought to project. he said he promoted force, for instance, only as a last resort to ""deprive jews of power"" and to get them to live in isolation. ""we could dictate terms before taking action,"" he suggested. ""if you will cease and desist from trying to subvert western civilization and exterminating the white race, then we can make a truce. . . . i don't care if we sit down and talk to these people or if we exterminate them, but i'd prefer to talk."" likewise, although he would like to segregate blacks in a country of their own, he said he would first try to do so through negotiation, because he felt sympathy for them. ""it's like, i love my dog, too,"" he said. ""i don't beat my dog, and i feed him . . . but i don't give him equal rights or have sex with him."" even on key questions such as inducing poland to cede land to germany, lauck tried to offer clever solutions. ""we'll offer to bribe them, give them economic aid, which they'll take,"" he said, "". . . because we'll also tell them if you don't do this, we'll invade you and take back the territory and massacre you."" groups that monitor extremists - such as the anti-defamation league, the simon weisenthal center and the southern poverty law center - have tracked lauck for most of the 20 years he has been in the propaganda business. the fbi and the justice department's civil rights division have extensive files on him, according to officals of both agencies. as evidenced by the fact that he is still in business, dealing with extremists like lauck raises nettlesome legal, constitutional and ethical issues. john kundts of the fbi said ""it's more complex than a murder case or even a white-collar crime"" to determine how the self-styled propagandist can be prosecuted, since his operations are legal. but critics such as aaron breitbart, senior researcher at the wiesenthal center, pointed out that other democracies find ""it's perfectly legitimate to regulate freedom of expression at the point where, as with lauck, it leads to attacks and violence."" moreover, breitbart and others maintain that news organizations that write about neo-nazis may do some good by exposing their activities, but simultaneously provide their subjects with free publicity. on that count, at least, lauck agrees with his detractors. ""if you print an article in boston, mass., or any major city with a race problem, saying there's a guy publishing stickers that say 'deport niggers,' and he's in lincoln, neb., even if everything else says i'm a total monster or a total nut or a total lunatic - when i'm only 95 percent of those things - there will be people who want some of those stickers and write for literature,"" he said. ""then you get more literature in the field, and you get more support, you get more subscribers."" lauck was born in milwaukee in 1953 to parents of german ancestry, moved to lincoln as a child and began reading books such as hitler's ""mein kampf"" in his early teens. he said he skipped his senior year of high school, then concentrated on german-related courses during two years at the university of nebraska. at about age 17, gary rex lauck adopted the name gerhard ""for ethnic identification,"" and later apparently assumed something like a german accent and grew a mustache trimmed much like hitler's. lauck denied he affects an accent, saying his ""distinctive voice"" comes from having lived in milwaukee or having listened to german-speaking grandparents. while he portrays himself as relatively reasonable and said he was accepted by his parents and two siblings despite his views, police records paint a different picture. they show he was arrested in february 1978 for shooting his brother jerry, apparently after an argument about lauck's activities. jerry lauck survived, left the state and declined to press charges. lauck closely guards his activities, and german officals also do not like to discuss them. but sources said he routinely has used the us mail, often sending nondescript packages to phony post-office boxes, and also smuggled tons of material in the trunks of cars traveling over the german border from adjoining nations. he has been arrested in germany three times: in 1972 for distributing nazi literature, in 1974 for delivering a speech about ""why hitler is still so popular in the united states"" and in 1976 for toting around 20,000 nazi stickers. after serving 4 1/2 months in jail on that last charge, he was expelled from germany for life, although he was allowed back in 1979 to testify at a trial.  in the interview, lauck said he also has sneaked into the country several times since but prefers to meet with collaborators in neighboring nations. suall, of the anti-defamation league, was among several us officials who expressed hope that newfound fbi interest in lauck might finally lead to legal action against him.  ""this is a guy who provides ammunition to the most hateful kinds of people and, worse, influences young people,"" said suall. ""he's sufficiently dangerous . . . that his activities should be exposed, so concern becomes widespread enough for the american government to do something.""",https://drive.google.com/file/d/1jaApEmHqYa04O4UKMABr3Tq0s9btnNOQ/view,Asian,1
