text,link,race_label,race_discussed
"HAPPY BIRTHDAY for Saturday, Feb. 25, 2017: This year you head in a new direction. Your determination to get past a problem, or perhaps several problems, only enhances your drive and stamina. You could act in unpredictable ways, especially with your funds. If you are single, know that not everyone is going to be to your liking. Remain easygoing, and get to know a person well before considering making a commitment. If you are attached, the two of you need plenty of one-on-one time. Sometimes you play into a sense of drama that exists between you. A fellow PISCES knows how to make you smile from ear to ear. ARIES (March 21-April 19)
 Friends surround you, no matter what you are doing. You could be going to watch a basketball game or heading out for a drive. Someone close to you might act in a most unexpected way. Unusual opportunities are likely to emerge as a result. Tonight: Don't overthink a problem. TAURUS (April 20-May 20) You could be stiff and perhaps not as fluid as you'd like to be. Make a call, head out the door and touch base with a loved one. You might be under duress. Please note how helpful a younger person wants to be. Resist the urge to say too much. Tonight: Play it cool. GEMINI (May 21-June 20) You might want to rethink a decision more carefully. Ask yourself how the other involved parties feel, and determine what would be best for each individual. In the process, a loved one will remind you how caring you can be. Tonight: Accept your role. CANCER (June 21-July 22) One-on-one relating proves rewarding and fulfilling. Your way of handling a personal matter could change as a result. Caring surrounds you, especially on the homefront. Don't hesitate to express your concerns. Others want you to feel comfortable. Tonight: Off to a concert. LEO (July 23-Aug. 22) Someone clearly appreciates your time and attention. You might want to handle certain responsibilities first, before getting together. A friend or loved one wants to share more of his or her feelings. You could be surprised by what you hear. Tonight: Enjoy the attention and caring. VIRGO (Aug. 23-Sept. 22) You might want to indulge a child or loved one. Someone close to you tends to create uproar when you least expect it. Goodwill comes forward in a discussion that allows you to clear the air with this person. Tonight: Do what you want. Enjoy a favorite sport or hobby. LIBRA (Sept. 23-Oct. 22) You could be doing things in multiples. You might want to get a stronger sense of what is possible regarding your ability to handle certain situations. Call upon your self-discipline to tame a tendency toward excess. Strong feelings emerge from out of the blue. Tonight: Pace yourself. SCORPIO (Oct. 23-Nov. 21) Stay close to home during the day. You might be heavily involved with a project or simply want to get some R and R. Express your caring to the people in your immediate circle. You will find that it could be a lot easier than you had anticipated. Tonight: With a favorite person. SAGITTARIUS (Nov. 22-Dec. 21) You could be surprised to hear what a friend is doing, and you might decide to join him or her. You will enjoy hanging out in your neighborhood or taking a ride not too far out of town. Your seriousness could put a damper on things, but this mood will pass quickly. Tonight: Hang out. CAPRICORN (Dec. 22-Jan. 19) You seem to be too confident for your own good right now. You could be out and about doing some price comparison. An older relative or friend might have a suggestion that no one has thought of yet; think seriously about this suggestion. Tonight: You don't need to go far. AQUARIUS (Jan. 20-Feb. 18) Enjoy all the laughable conversations happening around you. A friend could add a very serious tone that might make you rather uncomfortable. Ask yourself what bothers you about this behavior. Coming up with the answer will be important. Tonight: Treat a friend to dinner. PISCES (Feb. 19-March 20) Take some much-needed personal time. If you want to be a couch potato, make it so. In any case, you are at the end of a quiet period where the action is likely to ramp up. Do a better job of listening when having an important talk. Tonight: Out and about, strutting your stuff. Jacqueline Bigar is on the Internet at www.jacquelinebigar.com. (c) 2017 by King Features Syndicate Inc.",https://drive.google.com/open?id=1tkTCeDSozTYDkYtAKKaYoykE9KcvgD8j&usp=drive_copy,N/A - not specified,0
"caryn and i raised our kids together. we were kids together, but we didn't know it then. we thought we were grown-ups, 19 and 20, both of us in love, engaged, both of us planning our weddings. she was my husband's friend first. he knew her from trinity episcopal church, where both their families were active members, in the choir, on committees. we met for the first time at her parents' house. it was christmas eve. she introduced me to her fiancé, john.
that was the beginning. her daughter michele was born first. then my son rob. then kerry to her and lauren to me. then five years later, she had sarah and i had julie. our kids were friends. our husbands were friends. we were friends. these were good times. we lived only seven miles apart for 20 years. there must have been days we didn't see each other, didn't strap our kids into the car and drive to each other's house. but i don't remember those days. i remember playing. we were always playing. we took the kids to parks and to playgrounds and to jolly cholly's, and we took them, most times, just to each other's houses, where we'd hang out, coloring, making ice cream, making a mess. on weekend nights we played cards or yahtzee with our husbands, one week at her house, the next week at mine. eventually we played racquetball every weekend, ending the night with pizza at the town spa. caryn taught me that plaids are supposed to match. she also taught me how to match them and how to interface collars and how to make bound buttonholes. she taught me to knit, too, and to crochet, and to not be afraid to do a back flip off the diving board. one spring, she signed me up for tennis lessons — that was a bust. and winter after winter she tried to teach me to ice skate. she still does all these things. her house was always under construction. john kept building rooms, adding on, adding up. i never thought they'd move. but caryn got breast cancer and after chemo and radiation and months of feeling sick and wondering if she'd ever be better, she was. cancer changed her life. she always wanted to live by the ocean. so she and john sold their sprawling house in walpole along with most of its contents and bought a little place right on the water in scituate. and john got to work adding on and adding up there. caryn found her purpose: working with the elderly. she jumped out of a plane. she ran the boston marathon. she golfed with john. she bought a kayak. she loved this new part of her life. but she was no longer just seven miles away, so there was no hanging out every friday night. no ""i was in the neighborhood, so i thought i'd stop by."" things changed. our kids grew up and then we had grandkids and jobs and more to do than when our kids were little. still, we saw each other at holidays and birthdays and christenings and baby showers and random times when we'd meet for dinner, just the two of us, just because. and we saw each other on the cape, for a few days in the summer, her kids and their kids and my kids and grandkids. all of us, together. and every time, all the time, it was like old times. last week she and john moved to south carolina. ""it's only a plane ride away,"" we both said. ""we hardly see each other anyway. we'll probably see each other more. we'll talk. we'll text. it will all be fine."" and maybe it will be. but it doesn't feel fine today. it feels like loss. it feels like the empty space a carnival leaves behind when it packs up and leaves town. it feels like what it is: a thousand-mile gulf. we'll get used to it. but right now, today, i miss my friend. beverly beckham lives in canton. she can be reached at beverlybeckham@me.com",https://drive.google.com/open?id=1uDGrBXDmlRUK7wY6A68k2ANwvmVmHaKH&usp=drive_copy,White,1
"christopher weigl was ready to submit his ­final project of the semester wednesday for a multimedia class at boston university when a technical glitch stole all his editing work. it was the kind of thing that makes the average first-year graduate student crumble. not weigl. he stayed up late wednesday, finished the project, and sent it electronically to his professor, whose class he was scheduled to attend at 9 a.m. thursday, said peter southwick, director of photojournalism at bu's college of communication. weigl never made that class. the 23-year-old photojournalism grad student was killed on commonwealth avenue at 8:36 a.m. thursday after his bicycle collided with a tractor-trailer turning onto st. paul street. the crash, which shut down the 900 block of commonwealth ­avenue through the afternoon, is being investigated by boston police. no charges or citations have been issued. weigl was the fifth bicyclist killed in a crash in boston this year, an issue addressed at a ­previously scheduled city council meeting on bicycle safety just hours after the latest fatality. councilors observed a moment of silence for weigl at the start of the meeting.
boston police said weigl, who was riding in a marked bike lane, was wearing a helmet thursday. ""he was a calm hand on the wheel, had tons of common sense, very aware of the risks of riding a bike,"" said charlie ­maher, one of his three roommates. ""he was smart. he wasn't some reckless kid on a bike without a helmet. that's not the way he is at all."" the professor in weigl's multimedia class, peter smith, canceled regular class affairs thursday, opting to honor weigl's memory by showing his final project and another student's project, which happened to be a video profile of weigl. dan herard, weigl's roommate and friend since grade school, said weigl was the glue that kept friendships together. a ""goofy"" guy who always had a smile on his face, weigl enjoyed the outdoors, dancing to techno music, and seemed to befriend everyone he met, herard said. ""he always kept a positive attitude,"" herard said. ""he was one of those people. drove some people nuts because he was always happy. he was just chris; there's so much that ­encapsulates that."" kuan liu was aboard the green line's b train thursday morning when she came upon the chaotic scene on commonwealth avenue: a body covered in a white sheet under a tractor-trailer. a devastated liu later learned the person under that sheet was the very first friend she made at bu, where she is enrolled as an international student. he was her assigned ambassador at the school, helping her navigate a new school and country. weigl would invite liu to his brighton apartment, as he did all his friends, to watch television. when liu could not under­stand what was being said, weigl would patiently ­explain it all. ""he would always help me. he would walk me home when i was by myself to make sure i'm safe,"" liu said. ""i can't imagine this person in my life is the person under the white cloth."" hours after the collision, more than 60 bicycling advocates gathered in city hall's council chambers for a bike safety meeting sponsored by councilors at large ayanna pressley and felix arroyo. while councilors and bike advocates acknowledged that the quality of cycling in boston had improved drastically in ­recent years   more than 50 miles of bike lanes have been added since 2007   they agreed the city urgently needs to take a closer look at safety. from jan. 1 to nov. 13, there have been 579 bicycle-related incidents in the city that required response by emergency medical services, said kristopher carter, interim director at boston bikes, the city's cycling initiative. in that same period in 2011, there were 548 bicycle-related incidents requiring ems response, he said. although the number of acci­dents has increased about 5 percent from last year, carter said it is difficult to say whether the statistics point to a decline in cyclist safety or reflect more bicyclists taking to the road. from 2011 to 2012, the city saw a 31 percent increase in bicyclists on the streets, he said. pete stidman, executive ­director of the boston cyclists union, called on officials to move beyond the who-was-at-fault blame game after bike ­fatalities, and to talk about ways to rethink the city's transportation infrastructure. ""what you hear a lot is, 'what are we doing about these scofflaw cyclists?' i'm not saying that cyclists don't cause acci­dents; they do,"" said stidman, citing one study that found bicyclists at fault in one-quarter of bike accidents. ""but that is not the key problem."" councilor matt o'malley agreed. ""helmets are so important, but it's not just about helmets,"" he said. ""it's not just about blaming the victims that way. it's about having serious conversations about what we need to do."" much of the discussion ­focused on cycle tracks, lanes for bicycles that are physically protected from vehicular traffic with medians, plastic posts, or an aisle of parked cars. they have been successful in cities such as montreal, but require more money and road space than regular bike lanes. advocates also stressed the importance of obtaining comprehensive data on accidents, rather than piecemeal data from various city agencies that often lack crucial details about the nature of a bike accident. until recently, some police and ems reports did not differentiate between collisions involving pedestrians or a bicyclist. carter said city officials are working to publish a more thorough report by year's end. stanley brown, who works at the cvs pharmacy at the intersection where weigl collided with the truck, said that he noticed the tractor-trailer making a right turn onto st. paul street from the far left lane that the ­bicycle ""was just going too fast to react to the truck."" ""when i saw him get hit, i knew there's nothing really that could be done,"" brown said. ""there was no way he could have survived that."" he said the truck driver got out of his vehicle, looked briefly at the bicyclist, and then returned to his cab. he appeared shaken but showed no obvious sign of intoxication or impairment, brown said. carter, of boston bikes, said commonwealth avenue is ­often clogged with pedestrians, bicyclists, motor vehicles, and mbta green line trolleys. the dean of bu's communications college, tom fiedler, said grief counselors and university chaplains are being made available to students, faculty, and staff. southwick, director of the college's photojournalism program, described weigl as ""one of the best students i've ever had in the program."" ""what stood out the most was his sensitivity, his ability to connect with people so that you saw emotional power in the photographs. they weren't posed, they weren't self-conscious, they were genuine. the kind of moments that allow a viewer to share the experience and get into the life of his subjects."" globe correspondent melissa m. werthmann contributed to this report. katheleen conti can be reached at kconti@globe.com martine powers can be reached at mpowers@globe.com",https://drive.google.com/open?id=1UJU6q-Tc-gtkp_EWtYXZhDvxgMhiqlTD&usp=drive_copy,N/A - not specified,0
"South African riot police fired rubber bullets to disperse immigrants and protesters who clashed during a march Friday in Pretoria.
JOHANNESBURG — Anti-immigrant protesters clashed with foreigners during a march in South Africa's administrative capital, Pretoria, on Friday, and the police responded with rubber bullets, tear gas, and water cannons. President Jacob Zuma appealed for calm and condemned the latest wave of anti-foreigner violence to grip South Africa in recent years. ""Many citizens of other countries living in South Africa are law-abiding and contribute to the economy of the country positively,"" Zuma said. ""It is wrong to brand all nonnationals as drug dealers or human traffickers,"" he said. ""Let us isolate those who commit such crimes and work with government to have them arrested, without stereotyping and causing harm to innocent people."" Africans coming legally and illegally to South Africa, which has the continent's most advanced economy, have been the focus of criticism and resentment and sometimes of violent attacks in recent years. South Africans accuse migrants of stealing jobs or exploiting locals by running small businesses in poor, black townships. Others blame foreigners for the country's high crime rates. The accusations, which are not backed up by official statistics, resonate in a country with a jobless rate of 27 percent and yawning income inequalities. The latest anti-immigrant violence began in a neighborhood south of Johannesburg called Rosettenville, where residents burned down a dozen houses that they said were being used by Nigerians as drug dens and brothels. The attacks spread to other areas, including in Pretoria, where immigrant areas and businesses were targeted. New York Times",https://drive.google.com/open?id=1NTqV9ZsSQOmH_lNu9gobripVdtOcRhVf&usp=drive_copy,Black,1
"q. i am in seventh grade. i think that my parents' marriage is happy, but they have problems. i think these problems are mostly my mother's fault, because she is constantly accusing my dad of doing little things wrong. she never actually confronts him about it but complains to me, which makes me feel like she is putting me in an unfair position. she also claims that he shuts her out of conversations and shoots her down when she tries to talk, but i frankly feel that he is just defending his argument and that she is being extra-sensitive on purpose. most of the time they get along ok, but they never kiss (at least not in front of me) and they don't really act like they are in love anymore.
i think they need marriage counseling, but i don't know how to talk to them about it. this has become very painful for me. how can i persuade them to go to marriage counseling? i am very scared that they will become very unhappy with each other, and get a divorce. parents with problems a. your parents may have marital problems, but one big mistake they're making is to involve you in their personal, adult relationship. you are in seventh grade   you should not be expected to take sides in their disputes or mediate their marriage. you are obviously bright and perceptive. i can understand why they trust your point of view, but they may not realize the extent to which they violate your right to be a kid. tell them both: ""i worry so much when you don't get along. i wish you would not involve me in your arguments. and i really wish you would see a professional because i don't know how to help you, and i'm worried you'll get divorced."" i hope they will follow your excellent instinct and seek marriage counseling. q. i have been a widow for seven years. after grieving for a while, i joined a singles club and met a man who was fun to be around. i started dating him, and we had a lot in common. my problem is that this man has a napoleon complex: he needs other women around him.he is always out helping other single women with auto and home projects. when we are out together in local clubs, he leaves me sitting by myself while he asks women sitting alone to dance. i am totally fed up and doubt if he will ever change. should i accept him as he is, or break up and find a better companion? down and out a. unless your guy has a hankering to invade switzerland, i don't think he has a napoleon complex. he sounds instead like a fun flirt. he will not change because he has no incentive to change. if you want a different outcome, you should choose a partner who won't engage you in a game of musical chairs. q. ""worried husband"" asked if it was ok to have a ""secret friendship"" with another woman. friendships help us get through life. one problem with our understanding of marriage is that it should be the ""be-all and end-all"" relationship. that is simply impossible. it's this wrong-headed belief that drives us to feel as if we must have ""secret"" relationships. if we can learn to develop honest relationships with our spouses (and our friends), we avoid the destructive baggage that comes with keeping secrets. your spouse doesn't need to know every single thing that you do or say or feel, but she/he does have the right to not be lied to. secrets, in the sense of this situation, are lies. sally a. i agree. thank you. send questions via e-mail to askamy@tribune.com or by mail to ask amy, chicago tribune, tt500, 435 n. michigan ave., chicago, il 60611.",https://drive.google.com/open?id=1QSKde0Pks3kjqjMS0qa2OMfERSyp3kY_&usp=drive_copy,N/A - not specified,0
